"headline";"subheadline";"author";"content";"newspaper_name";"publication_date";"page_number"
"NA";"NA";"NA";"NA";"trome";"2021-03-02";"2"
"El impacto de la tecnología en el trabajo remoto";"Un análisis profundo";"Juan Pérez";"En los últimos años, hemos visto una transformación significativa en cómo se lleva a cabo el trabajo. La pandemia aceleró esta tendencia hacia el trabajo remoto, obligando a muchas empresas a adaptarse rápidamente. Tecnologías como las videoconferencias y las plataformas de colaboración en línea han jugado un papel crucial en este cambio. Sin embargo, no todo ha sido positivo; algunos empleados reportan sentirse más aislados y con una mayor carga de trabajo debido a la falta de límites claros entre el tiempo laboral y personal.";"trome";"2021-03-02";"2"
"La importancia del turismo sostenible";"Un futuro mejor para todos";"Ana Gómez";"El turismo es una industria vital que genera empleo y fomenta la comprensión cultural. Sin embargo, su impacto ambiental no puede ser ignorado. Es crucial adoptar prácticas de turismo sostenible para proteger los destinos naturales y culturales para las futuras generaciones. Esto incluye desde reducir el desperdicio hasta apoyar a las comunidades locales.";"trome";"2021-03-02";"2"
"Avances en la lucha contra el cambio climático";"Innovación y colaboración global";"Carlos Rodríguez";"El cambio climático sigue siendo uno de los mayores desafíos del siglo XXI. Afortunadamente, hay avances significativos gracias a la innovación tecnológica y la colaboración internacional. Países alrededor del mundo están implementando políticas más estrictas para reducir las emisiones de carbono y promover energías renovables.";"trome";"2021-03-02";"2"
"El arte como herramienta de resistencia";"Explorando nuevas formas de expresión";"Marta Sánchez";"En tiempos de crisis, el arte se convierte en una poderosa forma de protesta y resistencia. Artistas de todo el mundo están utilizando su trabajo para abordar temas sociales y políticos, creando conciencia y fomentando el cambio. Desde murales hasta performances, el arte sigue siendo un medio vital para la expresión personal y colectiva.";"trome";"2021-03-02";"2"
"La educación en tiempos de pandemia";"Desafíos y oportunidades";"Luis Fernández";"La pandemia ha transformado radicalmente el sistema educativo global. La transición al aprendizaje en línea ha presentado desafíos significativos, pero también ha abierto nuevas oportunidades para innovar en la enseñanza. Es esencial que las instituciones educativas continúen adaptándose y buscando formas de mejorar la experiencia del estudiante.";"trome";"2021-03-02";"2"
"La economía post-pandemia";"¿Qué nos espera?";"Elena Martínez";"A medida que el mundo comienza a recuperarse de la pandemia, surgen preguntas sobre cómo será la economía en los próximos años. Expertos predicen cambios significativos en las industrias y en el comportamiento del consumidor. La digitalización acelerada y el trabajo remoto podrían ser tendencias que perduren mucho tiempo después de la crisis.";"trome";"2021-03-02";"2"
"Salud mental: un tema prioritario";"Abordando el bienestar emocional";"Sofía López";"La pandemia ha tenido un impacto profundo en la salud mental de muchas personas. Es crucial abordar este problema con seriedad, ofreciendo recursos y apoyo a quienes lo necesiten. La concienciación sobre la importancia del bienestar emocional es más importante que nunca.";"trome";"2021-03-02";"2"
"El futuro de los vehículos eléctricos";"Hacia una movilidad sostenible";"Pedro Gutiérrez";"Los vehículos eléctricos están ganando terreno rápidamente como una alternativa viable a los automóviles tradicionales. Con mejoras en la tecnología de baterías y un aumento en las estaciones de carga, el futuro parece prometedor para esta industria. Sin embargo, aún existen desafíos que deben ser superados para lograr una movilidad completamente sostenible.";"trome";"2021-03-02";"2"
"La literatura como reflejo de la sociedad";"Explorando temas contemporáneos";"María Fernández";"Los escritores han utilizado siempre su obra para comentar sobre los problemas sociales y políticos de su tiempo. En la actualidad, no es diferente; la literatura sigue siendo un medio poderoso para explorar temas como la identidad, la justicia social y el cambio climático.";"trome";"2021-03-02";"2"
"La ciencia detrás del envejecimiento";"Descubrimientos recientes";"Ricardo Sánchez";"El envejecimiento es un proceso complejo que ha intrigado a los científicos durante décadas. Recientemente, se han hecho avances significativos en la comprensión de los mecanismos biológicos detrás del envejecimiento, lo que podría llevar a tratamientos para prolongar la vida saludable.";"trome";"2021-03-02";"2"
"La música como forma de conexión";"Uniendo culturas y generaciones";"Laura García";"La música tiene el poder único de unir personas de diferentes orígenes. En una época donde las divisiones parecen más pronunciadas, la música sigue siendo un puente que conecta culturas y generaciones, ofreciendo esperanza y alegría.";"trome";"2021-03-02";"2"
"El papel del periodismo en la democracia";"Información veraz y objetiva";"Jorge Martínez";"En una era de desinformación y noticias falsas, el periodismo juega un rol crucial en mantener informada a la sociedad. Los medios deben comprometerse con la precisión y la imparcialidad para fortalecer las democracias alrededor del mundo.";"trome";"2021-03-02";"2"
"La innovación en la agricultura";"Tecnologías que cambian el futuro de los alimentos";"Carmen López";"Con una población mundial en crecimiento, es vital encontrar formas más eficientes y sostenibles de producir alimentos. La tecnología está revolucionando la agricultura con soluciones como la agricultura vertical y la edición genética, prometiendo un futuro alimentario más seguro.";"trome";"2021-03-02";"2"
"El impacto del deporte en la sociedad";"Más que solo juegos";"David Torres";"El deporte tiene el poder de inspirar y unir a las personas. Más allá de la competencia, fomenta valores como el trabajo en equipo, la disciplina y la perseverancia. En tiempos difíciles, el deporte puede ser una fuente de esperanza y unidad.";"trome";"2021-03-02";"2"
"La evolución del cine";"Nuevas narrativas y tecnologías";"Sofía Ramírez";"El cine ha experimentado transformaciones significativas en las últimas décadas. Con la llegada de nuevas tecnologías como el CGI y el streaming, las formas de contar historias han evolucionado, ofreciendo experiencias cinematográficas más inmersivas y accesibles.";"trome";"2021-03-02";"2"
"La importancia del arte culinario";"Más que solo comida";"Carlos Hernández";"El arte culinario es una expresión cultural rica y diversa. Los chefs no solo crean platos deliciosos, sino que también cuentan historias a través de sus recetas, preservando tradiciones y explorando nuevas fronteras gastronómicas.";"trome";"2021-03-02";"2"
"La educación financiera para todos";"Herramientas para una vida económica saludable";"Elena Gómez";"En un mundo cada vez más complejo, la educación financiera es fundamental. Conocer cómo gestionar el dinero puede marcar la diferencia en la calidad de vida de las personas, ayudándolas a tomar decisiones informadas y a planificar su futuro.";"trome";"2021-03-02";"2"
"El papel del diseño urbano en nuestras vidas";"Creando ciudades más habitables";"Miguel Ángel Sánchez";"El diseño urbano influye directamente en la calidad de vida de los ciudadanos. Espacios bien diseñados pueden mejorar el bienestar social, promover la sostenibilidad y fomentar una mayor interacción comunitaria.";"trome";"2021-03-02";"2"
"La ciencia detrás del sueño";"Descubrimientos que cambian nuestra comprensión";"Laura Fernández";"El sueño es un fenómeno fascinante que sigue siendo objeto de estudio. Los científicos están descubriendo más sobre su importancia para la salud y el bienestar, lo que podría llevar a nuevas formas de tratar problemas relacionados con el sueño.";"trome";"2021-03-02";"2"
"La música como terapia";"El poder curativo del sonido";"Javier López";"La música no solo es una forma de entretenimiento; también tiene propiedades terapéuticas. Se ha demostrado que puede ayudar a reducir el estrés, mejorar el estado de ánimo y hasta aliviar dolores físicos.";"trome";"2021-03-02";"2"
"El futuro del trabajo autónomo";"Desafíos y oportunidades en la era digital";"Isabel Martínez";"La economía colaborativa está transformando el mercado laboral. El trabajo autónomo ofrece flexibilidad, pero también presenta desafíos como la falta de seguridad social. Es crucial encontrar un equilibrio que beneficie tanto a trabajadores como a empresas.";"trome";"2021-03-02";"2"
"El arte digital en la era moderna";"Explorando nuevas fronteras creativas";"Pedro Gutiérrez";"El arte digital está redefiniendo lo que significa ser artista en el siglo XXI. Con herramientas tecnológicas avanzadas, los artistas pueden crear obras innovadoras y accesibles a una audiencia global.";"trome";"2021-03-02";"2"
"La importancia de la biodiversidad";"Protegiendo nuestro planeta";"María López";"La biodiversidad es fundamental para mantener el equilibrio ecológico del planeta. La pérdida de especies amenaza no solo a los ecosistemas, sino también al bienestar humano. Es crucial tomar medidas urgentes para proteger la diversidad biológica.";"trome";"2021-03-02";"2"
"El papel de las redes sociales en la política";"Influencia y responsabilidad";"Ricardo Sánchez";"Las redes sociales han cambiado la forma en que se lleva a cabo la política. Aunque ofrecen una plataforma para la participación ciudadana, también presentan riesgos como la desinformación y el ciberacoso.";"trome";"2021-03-02";"2"
"La evolución de los videojuegos";"Más allá del entretenimiento";"Laura García";"Los videojuegos han evolucionado de ser simples pasatiempos a convertirse en una industria cultural influyente. Ofrecen experiencias inmersivas que pueden educar, inspirar y conectar a personas de todo el mundo.";"trome";"2021-03-02";"2"
"El impacto del cambio climático en la salud pública";"Desafíos emergentes";"Jorge Martínez";"El cambio climático no solo afecta al medio ambiente; también tiene implicaciones directas para la salud pública. Desde enfermedades transmitidas por vectores hasta problemas respiratorios, es crucial abordar estos desafíos de manera proactiva.";"trome";"2021-03-02";"2"
"La literatura como herramienta educativa";"Fomentando el amor por la lectura";"Sofía Ramírez";"La literatura no solo entretiene; también educa. A través de las historias, los lectores pueden aprender sobre diferentes culturas, épocas y perspectivas, fomentando una comprensión más profunda del mundo.";"trome";"2021-03-02";"2"
"El papel de la tecnología en la educación";"Herramientas para un aprendizaje mejorado";"Carmen López";"La tecnología está transformando el panorama educativo. Herramientas digitales como las plataformas de aprendizaje en línea y los recursos interactivos están haciendo que la educación sea más accesible y personalizada.";"trome";"2021-03-02";"2"
"El arte del storytelling";"Narrativas poderosas para un cambio social";"David Torres";"El storytelling es una herramienta poderosa para influir en la opinión pública y fomentar el cambio social. A través de historias bien contadas, se pueden abordar temas complejos y sensibilizar a las audiencias sobre problemas importantes.";"trome";"2021-03-02";"2"
"La importancia del patrimonio cultural";"Preservando nuestra historia";"Elena Gómez";"El patrimonio cultural es una parte integral de la identidad de un país. Preservarlo no solo honra el pasado, sino que también enriquece el presente y asegura su legado para las futuras generaciones.";"trome";"2021-03-02";"2"
"La ciencia detrás del aprendizaje";"Descubriendo cómo se forma la memoria";"Miguel Ángel Sánchez";"El cerebro humano es un órgano fascinante, especialmente en lo que respecta al proceso de aprendizaje. Los científicos están descubriendo más sobre cómo se forman y consolidan las memorias, lo que podría llevar a métodos educativos más efectivos.";"trome";"2021-03-02";"2"
"La música como forma de protesta";"Haciendo oír la voz del cambio";"Laura Fernández";"A lo largo de la historia, la música ha sido una herramienta poderosa para el activismo. Los artistas han utilizado sus canciones para denunciar injusticias y movilizar a las masas en busca de un cambio social.";"trome";"2021-03-02";"2"
"El futuro de la inteligencia artificial";"Desafíos éticos y oportunidades";"Javier López";"La inteligencia artificial está revolucionando múltiples industrias, pero también plantea desafíos éticos significativos. Es crucial abordar estos problemas para asegurar que el desarrollo tecnológico beneficie a toda la sociedad.";"trome";"2021-03-02";"2"
"El papel de las artes escénicas en la educación";"Fomentando habilidades creativas y críticas";"Isabel Martínez";"Las artes escénicas no solo son una forma de entretenimiento; también son herramientas educativas valiosas. Participar en teatro, danza o música puede desarrollar habilidades como la empatía, el pensamiento crítico y la creatividad.";"trome";"2021-03-02";"2"
"El impacto del turismo cultural";"Beneficios y desafíos para las comunidades locales";"Pedro Gutiérrez";"El turismo cultural ofrece oportunidades económicas significativas para las comunidades locales. Sin embargo, también presenta desafíos como el riesgo de la comercialización excesiva y la pérdida de autenticidad cultural.";"trome";"2021-03-02";"2"
"La ciencia detrás del estrés";"Entendiendo y gestionando nuestras respuestas";"María López";"El estrés es una respuesta natural del cuerpo a situaciones desafiantes, pero cuando se vuelve crónico puede tener efectos negativos en la salud. Comprender los mecanismos biológicos detrás del estrés es clave para desarrollar estrategias de manejo efectivas.";"trome";"2021-03-02";"2"
"El papel de las redes sociales en la formación de identidad";"Influencias positivas y negativas";"Ricardo Sánchez";"Las redes sociales juegan un papel crucial en cómo los individuos se perciben a sí mismos y son percibidos por otros. Aunque pueden ofrecer oportunidades para la autoexpresión, también presentan riesgos como la comparación social y la presión de conformidad.";"trome";"2021-03-02";"2"
"La evolución del periodismo digital";"Nuevas formas de contar historias";"Laura García";"El periodismo ha experimentado una transformación significativa con el auge de las plataformas digitales. Los medios ahora tienen que adaptarse a un entorno donde la información es instantánea y los consumidores son más activos en la creación de contenido.";"trome";"2021-03-02";"2"
"La importancia del arte contemporáneo";"Reflejando nuestra era";"Jorge Martínez";"El arte contemporáneo no solo es una expresión estética; también es un comentario sobre el mundo actual. A través de diversas formas y medios, los artistas contemporáneos exploran temas relevantes como la tecnología, la globalización y las identidades sociales.";"trome";"2021-03-02";"2"
"La ciencia detrás del envejecimiento";"Descubrimientos recientes";"Sofía Ramírez";"El envejecimiento es un proceso complejo que ha intrigado a los científicos durante décadas. Recientemente, se han hecho avances significativos en la comprensión de los mecanismos biológicos detrás del envejecimiento, lo que podría llevar a tratamientos para prolongar la vida saludable.";"trome";"2021-03-02";"2"
"La música como forma de conexión";"Uniendo culturas y generaciones";"Carmen López";"La música tiene el poder único de unir personas de diferentes orígenes. En una época donde las divisiones parecen más pronunciadas, la música sigue siendo un puente que conecta culturas y generaciones, ofreciendo esperanza y alegría.";"trome";"2021-03-02";"2"
"El papel del periodismo en la democracia";"Información veraz y objetiva";"David Torres";"En una era de desinformación y noticias falsas, el periodismo juega un rol crucial en mantener informada a la sociedad. Los medios deben comprometerse con la precisión y la imparcialidad para fortalecer las democracias.";"trome";"2021-03-02";"2"
"El impacto del cambio climático en la agricultura";"Desafíos y soluciones sostenibles";"Elena Gómez";"El cambio climático está afectando a la agricultura global, alterando patrones de lluvia y aumentando la frecuencia de eventos extremos. Es esencial desarrollar prácticas agrícolas sostenibles para asegurar el suministro de alimentos en el futuro.";"trome";"2021-03-02";"2"
"La ciencia detrás del aprendizaje";"Descubriendo cómo se forma la memoria";"Miguel Ángel Sánchez";"El cerebro humano es un órgano fascinante, especialmente en lo que respecta al proceso de aprendizaje. Los científicos están descubriendo más sobre cómo se forman y consolidan las memorias, lo que podría llevar a métodos educativos más efectivos.";"trome";"2021-03-02";"2"
"La música como terapia";"El poder curativo del sonido";"Laura Fernández";"La música no solo es una forma de entretenimiento; también tiene propiedades terapéuticas. Se ha demostrado que puede ayudar a reducir el estrés, mejorar el estado de ánimo y hasta aliviar dolores físicos.";"trome";"2021-03-02";"2"
"El futuro del trabajo autónomo";"Desafíos y oportunidades en la era digital";"Javier López";"La economía colaborativa está transformando el mercado laboral. El trabajo autónomo ofrece flexibilidad, pero también presenta desafíos como la falta de seguridad social. Es crucial encontrar un equilibrio que beneficie tanto a trabajadores como a empresas.";"trome";"2021-03-02";"2"
"El arte digital en la era moderna";"Explorando nuevas fronteras creativas";"Isabel Martínez";"El arte digital está redefiniendo lo que significa ser artista en el siglo XXI. Con herramientas tecnológicas avanzadas, los artistas pueden crear obras innovadoras y accesibles a una audiencia global.";"trome";"2021-03-02";"2"
"La importancia de la biodiversidad";"Protegiendo nuestro planeta";"Pedro Gutiérrez";"La biodiversidad es fundamental para mantener el equilibrio ecológico del planeta. La pérdida de especies amenaza no solo a los ecosistemas, sino también al bienestar humano. Es crucial tomar medidas urgentes para proteger la diversidad biológica.";"trome";"2021-03-02";"2"
"El papel de las redes sociales en la política";"Influencia y responsabilidad";"María López";"Las redes sociales han cambiado la forma en que se lleva a cabo la política. Aunque ofrecen una plataforma para la participación ciudadana, también presentan riesgos como la desinformación y el ciberacoso.";"trome";"2021-03-02";"2"
"La evolución de los videojuegos";"Más allá del entretenimiento";"Ricardo Sánchez";"Los videojuegos han evolucionado de ser simples pasatiempos a convertirse en una industria cultural influyente. Ofrecen experiencias inmersivas que pueden educar, inspirar y conectar a personas de todo el mundo.";"trome";"2021-03-02";"2"
"El impacto del cambio climático en la salud pública";"Desafíos emergentes";"Laura García";"El cambio climático no solo afecta al medio ambiente; también tiene implicaciones directas para la salud pública. Desde enfermedades transmitidas por vectores hasta problemas respiratorios, es crucial abordar estos desafíos de manera proactiva.";"trome";"2021-03-02";"2"
"La literatura como herramienta educativa";"Fomentando el amor por la lectura";"Jorge Martínez";"La literatura no solo entretiene; también educa. A través de las historias, los lectores pueden aprender sobre diferentes culturas, épocas y perspectivas, fomentando una comprensión más profunda del mundo.";"trome";"2021-03-02";"2"
"El papel de la tecnología en la educación";"Herramientas para un aprendizaje mejorado";"Sofía Ramírez";"La tecnología está transformando el panorama educativo. Herramientas digitales como las plataformas de aprendizaje en línea y los recursos interactivos están haciendo que la educación sea más accesible y personalizada.";"trome";"2021-03-02";"2"
"El arte del storytelling";"Narrativas poderosas para un cambio social";"Carmen López";"El storytelling es una herramienta poderosa para influir en la opinión pública y fomentar el cambio social. A través de historias bien contadas, se pueden abordar temas complejos y sensibilizar a las audiencias sobre problemas importantes.";"trome";"2021-03-02";"2"
"La importancia del patrimonio cultural";"Preservando nuestra historia";"David Torres";"El patrimonio cultural es una parte integral de la identidad de un país. Preservarlo no solo honra el pasado, sino que también enriquece el presente y asegura su legado para las futuras generaciones.";"trome";"2021-03-02";"2"
"La ciencia detrás del estrés";"Entendiendo y gestionando nuestras respuestas";"Elena Gómez";"El estrés es una respuesta natural del cuerpo a situaciones desafiantes, pero cuando se vuelve crónico puede tener efectos negativos en la salud. Comprender los mecanismos biológicos detrás del estrés es clave para desarrollar estrategias de manejo efectivas.";"trome";"2021-03-02";"2"
"El papel de las redes sociales en la formación de identidad";"Influencias positivas y negativas";"Miguel Ángel Sánchez";"Las redes sociales juegan un papel crucial en cómo los individuos se perciben a sí mismos y son percibidos por otros. Aunque pueden ofrecer oportunidades para la autoexpresión, también presentan riesgos como la comparación social y la presión de conformidad.";"trome";"2021-03-02";"2"
"La evolución del periodismo digital";"Nuevas formas de contar historias";"Laura Fernández";"El periodismo ha experimentado una transformación significativa con el auge de las plataformas digitales. Los medios ahora tienen que adaptarse a un entorno donde la información es instantánea y los consumidores son más activos en la creación de contenido.";"trome";"2021-03-02";"2"
"La importancia del arte contemporáneo";"Reflejando nuestra era";"Javier López";"El arte contemporáneo no solo es una expresión estética; también es un comentario sobre el mundo actual. A través de diversas formas y medios, los artistas contemporáneos exploran temas relevantes como la tecnología, la globalización y las identidades sociales.";"trome";"2021-03-02";"2"
