"headline";"subheadline";"author";"content";"newspaper_name";"publication_date";"page_number"
"NA";"NA";"NA";"NA";"trome";"2021-03-02";"2"
"El impacto de la tecnología en la educación";"NA";"Juan Pérez";"En los últimos años, hemos visto una transformación significativa en el ámbito educativo gracias a la incorporación de nuevas tecnologías. Estas herramientas no solo han cambiado la forma en que se imparte el conocimiento, sino también cómo los estudiantes interactúan con él. La pandemia del COVID-19 aceleró esta tendencia, forzando a muchas instituciones educativas a adoptar plataformas digitales para continuar con sus actividades académicas de manera remota.";"trome";"2021-03-02";"2"
"NA";"NA";"NA";"Las clases virtuales se han convertido en una realidad cotidiana. Plataformas como Zoom, Google Classroom y Microsoft Teams son ahora parte integral del proceso educativo. Estos cambios no solo han permitido mantener la continuidad académica durante los confinamientos, sino que también han abierto nuevas posibilidades para el aprendizaje personalizado.";"trome";"2021-03-02";"2"
"NA";"NA";"NA";"Sin embargo, esta transición no ha sido fácil. Muchos estudiantes y profesores enfrentan desafíos significativos, como la falta de acceso a internet o dispositivos adecuados, lo que genera una brecha digital preocupante. Además, el aprendizaje en línea requiere nuevas habilidades tanto para los educadores como para los alumnos.";"trome";"2021-03-02";"2"
"NA";"NA";"NA";"A pesar de estos obstáculos, la tecnología ofrece oportunidades únicas para mejorar la calidad de la educación. Herramientas interactivas y recursos digitales pueden hacer que el aprendizaje sea más atractivo y efectivo. Además, la educación en línea permite una mayor flexibilidad horaria y acceso a un vasto contenido educativo global.";"trome";"2021-03-02";"2"
"NA";"NA";"NA";"En conclusión, aunque la tecnología ha traído consigo desafíos importantes, también representa una oportunidad para innovar y mejorar el sistema educativo. Es crucial que las instituciones trabajen en conjunto con los gobiernos y empresas tecnológicas para superar las barreras actuales y garantizar un acceso equitativo a la educación digital para todos.";"trome";"2021-03-02";"2"
"NA";"NA";"NA";"El futuro de la educación está indudablemente ligado al avance tecnológico, y es nuestra responsabilidad asegurarnos de que este camino sea inclusivo y beneficioso para cada estudiante.";"trome";"2021-03-02";"2"
