"headline";"subheadline";"author";"content";"newspaper_name";"publication_date";"page_number"
"NA";"NA";"NA";"NA";"trome";"2021-03-02";"2"
"El impacto de la tecnología en la educación";"NA";"Juan Pérez";"En los últimos años, hemos visto una transformación significativa en el ámbito educativo gracias a la incorporación de nuevas tecnologías. Estas herramientas no solo han cambiado la forma en que se imparte el conocimiento, sino también cómo los estudiantes interactúan con él.";"trome";"2021-03-02";"2"
"NA";"NA";"NA";"El uso de plataformas digitales ha permitido un acceso más amplio a recursos educativos, facilitando el aprendizaje autónomo y personalizado. Además, la tecnología ha fomentado una mayor colaboración entre estudiantes y profesores, rompiendo las barreras físicas del aula tradicional.";"trome";"2021-03-02";"2"
"NA";"NA";"NA";"Sin embargo, no todo es positivo. La dependencia excesiva de dispositivos electrónicos puede llevar a problemas como la disminución de habilidades sociales o el aumento de la distracción durante las clases. Es crucial encontrar un equilibrio adecuado para maximizar los beneficios sin caer en estos inconvenientes.";"trome";"2021-03-02";"2"
"NA";"NA";"NA";"En conclusión, la tecnología tiene el potencial de revolucionar la educación si se utiliza de manera consciente y estratégica. Los educadores deben estar preparados para adaptarse a estas nuevas herramientas y guiar a sus estudiantes en un entorno cada vez más digital.";"trome";"2021-03-02";"2"
"Breves del día";"NA";"NA";"Hoy, el clima estará soleado con una temperatura máxima de 25°C. Recuerda llevar protector solar si sales al exterior.";"trome";"2021-03-02";"2"
"Anuncio público";"NA";"NA";"La municipalidad informa que las obras en la avenida principal se extenderán hasta finales de mes. Se recomienda tomar rutas alternativas para evitar congestiones.";"trome";"2021-03-02";"2"
