"headline";"subheadline";"author";"content";"newspaper_name";"publication_date";"page_number"
"NA";"NA";"NA";"NA";"trome";"2021-03-02";"2"
"El impacto de la tecnología en la educación";"NA";"Juan Pérez";"En los últimos años, hemos visto una transformación significativa en el ámbito educativo gracias a la incorporación de nuevas tecnologías. Estas herramientas no solo han cambiado la forma en que se imparte el conocimiento, sino también cómo los estudiantes interactúan con él. La pandemia del COVID-19 aceleró esta tendencia, forzando a muchas instituciones educativas a adoptar plataformas digitales para continuar con sus actividades académicas de manera remota.";"trome";"2021-03-02";"2"
"NA";"NA";"NA";"Las clases virtuales se han convertido en una realidad cotidiana. Plataformas como Zoom, Google Classroom y Microsoft Teams son ahora parte integral del proceso educativo. Estos cambios no solo han permitido mantener la continuidad académica durante los confinamientos, sino que también han abierto nuevas posibilidades para el aprendizaje personalizado.";"trome";"2021-03-02";"2"
"NA";"NA";"NA";"Sin embargo, esta transición no ha sido fácil. Muchos estudiantes y profesores enfrentan desafíos significativos, como la falta de acceso a internet o dispositivos adecuados, lo que genera una brecha digital preocupante. Además, el aprendizaje en línea requiere nuevas habilidades tanto para los educadores como para los alumnos.";"trome";"2021-03-02";"2"
"NA";"NA";"NA";"A pesar de estos obstáculos, la tecnología ofrece oportunidades únicas para mejorar la calidad de la educación. Herramientas interactivas y recursos digitales pueden hacer que el aprendizaje sea más atractivo y efectivo. Además, la educación en línea permite una mayor flexibilidad horaria y acceso a un vasto contenido educativo global.";"trome";"2021-03-02";"2"
"NA";"NA";"NA";"En conclusión, aunque la tecnología ha presentado desafíos, también ha demostrado ser una aliada poderosa en el ámbito educativo. Es crucial que las instituciones continúen adaptándose y evolucionando para maximizar los beneficios de estas herramientas digitales.";"trome";"2021-03-02";"2"
"NA";"NA";"NA";"Por otro lado, es importante no perder de vista la importancia del contacto humano en la enseñanza. La educación no solo se trata de transmitir conocimientos, sino también de desarrollar habilidades sociales y emocionales que son fundamentales para el crecimiento personal.";"trome";"2021-03-02";"2"
"La crisis climática y su impacto en las ciudades";"NA";"María González";"Las ciudades del mundo están enfrentando desafíos sin precedentes debido al cambio climático. El aumento de temperaturas, la frecuencia de eventos extremos como huracanes e inundaciones, y la contaminación ambiental son solo algunos de los problemas que amenazan el bienestar urbano.";"trome";"2021-03-02";"2"
"NA";"NA";"NA";"Las metrópolis están buscando soluciones innovadoras para mitigar estos efectos. La implementación de infraestructuras verdes, como parques urbanos y techos vegetales, es una estrategia clave para combatir el calor excesivo y mejorar la calidad del aire.";"trome";"2021-03-02";"2"
"NA";"NA";"NA";"Además, muchas ciudades están invirtiendo en sistemas de transporte sostenible. El aumento del uso de bicicletas y vehículos eléctricos, junto con una mejor planificación urbana que promueva el caminar, son medidas esenciales para reducir las emisiones de carbono.";"trome";"2021-03-02";"2"
"NA";"NA";"NA";"La participación ciudadana también juega un papel crucial en esta lucha. Programas comunitarios que fomentan la concienciación y la acción local pueden tener un impacto significativo en la resiliencia urbana frente al cambio climático.";"trome";"2021-03-02";"2"
"NA";"NA";"NA";"En última instancia, abordar la crisis climática requiere una colaboración global. Las ciudades deben trabajar juntas para compartir conocimientos y recursos, asegurando que todos los habitantes del planeta puedan disfrutar de un futuro más sostenible.";"trome";"2021-03-02";"2"
"El arte como herramienta de resistencia";"NA";"Carlos Rivera";"En tiempos de crisis social y política, el arte se erige como una poderosa herramienta de resistencia. A través de diversas formas expresivas, los artistas han logrado captar la atención del público sobre temas críticos, inspirando movimientos sociales y fomentando el cambio.";"trome";"2021-03-02";"2"
"NA";"NA";"NA";"La historia está llena de ejemplos donde el arte ha desempeñado un papel fundamental en la lucha por los derechos humanos. Desde murales que denuncian injusticias hasta canciones que se convierten en himnos de protesta, el arte tiene el poder de movilizar y unir a las personas.";"trome";"2021-03-02";"2"
"NA";"NA";"NA";"En la actualidad, con el acceso a plataformas digitales, los artistas tienen una audiencia global. Esto amplifica su capacidad para influir en el discurso público y promover causas importantes. Las redes sociales han permitido que mensajes artísticos lleguen a millones de personas en cuestión de segundos.";"trome";"2021-03-02";"2"
"NA";"NA";"NA";"Sin embargo, este poder también trae consigo desafíos. Los artistas deben navegar entre la expresión creativa y las restricciones impuestas por gobiernos o corporaciones que buscan controlar el mensaje. La censura sigue siendo una amenaza constante para la libertad de expresión.";"trome";"2021-03-02";"2"
"NA";"NA";"NA";"A pesar de estos obstáculos, el arte continúa siendo un faro de esperanza y resistencia. Al desafiar el status quo y ofrecer nuevas perspectivas, los artistas contribuyen a una sociedad más justa e igualitaria.";"trome";"2021-03-02";"2"
"NA";"NA";"NA";"En resumen, el arte no solo es una forma de expresión personal, sino también un instrumento vital para la transformación social. Su capacidad para inspirar y movilizar hace que sea indispensable en cualquier movimiento por el cambio.";"trome";"2021-03-02";"2"
