"headline";"subheadline";"author";"content";"newspaper_name";"publication_date";"page_number"
"NA";"NA";"NA";"NA";"trome";"2021-03-02";"2"
"El impacto de la tecnología en la educación";"NA";"Juan Pérez";"En los últimos años, hemos visto una transformación significativa en el ámbito educativo gracias a la incorporación de nuevas tecnologías. Estas herramientas no solo han cambiado la forma en que se imparte el conocimiento, sino también cómo los estudiantes interactúan con él. La pandemia del COVID-19 aceleró esta tendencia, forzando a muchas instituciones educativas a adoptar plataformas digitales para continuar con sus actividades académicas de manera remota.";"trome";"2021-03-02";"2"
"NA";"NA";"NA";"Las clases virtuales se han convertido en una realidad cotidiana. Plataformas como Zoom, Google Classroom y Microsoft Teams son ahora parte integral del proceso educativo. Estos cambios no solo han permitido mantener la continuidad académica durante los confinamientos, sino que también han abierto nuevas posibilidades para el aprendizaje personalizado.";"trome";"2021-03-02";"2"
"NA";"NA";"NA";"Sin embargo, esta transición no ha sido fácil. Muchos estudiantes y profesores enfrentan desafíos significativos, como la falta de acceso a internet o dispositivos adecuados, lo que genera una brecha digital preocupante. Además, el aprendizaje en línea requiere nuevas habilidades tanto para los educadores como para los alumnos.";"trome";"2021-03-02";"2"
"NA";"NA";"NA";"A pesar de estos obstáculos, la tecnología ofrece oportunidades únicas para mejorar la calidad de la educación. Herramientas interactivas y recursos digitales pueden hacer que el aprendizaje sea más atractivo y efectivo. Además, la educación en línea permite una mayor flexibilidad horaria y acceso a un vasto contenido educativo global.";"trome";"2021-03-02";"2"
"NA";"NA";"NA";"En conclusión, aunque la tecnología ha presentado desafíos, también ha demostrado ser una aliada poderosa en el ámbito educativo. Es crucial que las instituciones continúen adaptándose y evolucionando para maximizar los beneficios de estas herramientas digitales.";"trome";"2021-03-02";"2"
"NA";"NA";"NA";"Por otro lado, es importante no perder de vista la importancia del contacto humano en la enseñanza. La educación no solo se trata de transmitir conocimientos, sino también de desarrollar habilidades sociales y emocionales que son fundamentales para el crecimiento personal.";"trome";"2021-03-02";"2"
"La influencia de las redes sociales en la política";"NA";"María González";"Las redes sociales han revolucionado la forma en que los políticos se comunican con sus electores. Plataformas como Twitter, Facebook e Instagram permiten a los candidatos y funcionarios públicos llegar directamente al público sin intermediarios.";"trome";"2021-03-02";"2"
"NA";"NA";"NA";"Esta nueva dinámica ha democratizado el acceso a la información política, pero también ha traído consigo desafíos significativos. La rapidez con la que se difunden noticias y opiniones en las redes sociales puede llevar a la propagación de información falsa o sesgada.";"trome";"2021-03-02";"2"
"NA";"NA";"NA";"Además, el uso de algoritmos para personalizar los contenidos que ven los usuarios puede crear 'burbujas de filtro', donde solo se exponen ideas y noticias que coinciden con las creencias previas del usuario. Esto puede polarizar aún más la opinión pública.";"trome";"2021-03-02";"2"
"NA";"NA";"NA";"Sin embargo, las redes sociales también han sido una herramienta poderosa para movilizar a los ciudadanos y promover el activismo político. Campañas en línea pueden generar conciencia sobre temas importantes y motivar a las personas a participar en acciones cívicas.";"trome";"2021-03-02";"2"
"NA";"NA";"NA";"En resumen, mientras que las redes sociales han transformado la política moderna de maneras positivas y negativas, es fundamental que los usuarios sean críticos con la información que consumen y busquen fuentes confiables para formarse una opinión bien fundamentada.";"trome";"2021-03-02";"2"
"El futuro del trabajo en la era digital";"NA";"Carlos Rodríguez";"La automatización y la inteligencia artificial están cambiando el panorama laboral a un ritmo sin precedentes. Muchos empleos tradicionales están siendo reemplazados por máquinas, lo que plantea preguntas sobre el futuro del trabajo humano.";"trome";"2021-03-02";"2"
"NA";"NA";"NA";"Por otro lado, estas tecnologías también están creando nuevas oportunidades laborales en campos emergentes como la ciberseguridad, el análisis de datos y el desarrollo de software. La clave está en adaptarse a estos cambios mediante la educación continua y la adquisición de nuevas habilidades.";"trome";"2021-03-02";"2"
"NA";"NA";"NA";"Las empresas deben invertir en la formación de sus empleados para que puedan trabajar junto a las máquinas, no solo como operadores sino también como supervisores y analistas. La colaboración entre humanos y tecnología puede llevar a una mayor eficiencia y creatividad.";"trome";"2021-03-02";"2"
"NA";"NA";"NA";"Además, es importante considerar el impacto social de estos cambios. Las políticas públicas deben adaptarse para garantizar que los beneficios de la digitalización del trabajo se distribuyan equitativamente entre todos los sectores de la sociedad.";"trome";"2021-03-02";"2"
"NA";"NA";"NA";"En conclusión, aunque la era digital presenta desafíos significativos para el mundo laboral, también ofrece oportunidades únicas para innovar y crecer. La clave será encontrar un equilibrio que permita a las personas prosperar en este nuevo entorno.";"trome";"2021-03-02";"2"
