"headline";"subheadline";"author";"content";"newspaper_name";"publication_date";"page_number"
"NA";"NA";"NA";"NA";"trome";"2021-03-02";"2"
"El impacto de la tecnología en la educación";"NA";"Juan Pérez";"En los últimos años, hemos visto una transformación significativa en el ámbito educativo gracias a la incorporación de nuevas tecnologías. Estas herramientas no solo han cambiado la forma en que se imparte el conocimiento, sino también cómo los estudiantes interactúan con él. La pandemia del COVID-19 aceleró esta tendencia, forzando a muchas instituciones educativas a adoptar plataformas digitales para continuar con sus actividades académicas de manera remota.";"trome";"2021-03-02";"2"
"NA";"NA";"NA";"Las clases virtuales se han convertido en una realidad cotidiana. Plataformas como Zoom, Google Classroom y Microsoft Teams son ahora parte integral del proceso educativo. Estos cambios no solo han permitido mantener la continuidad académica durante los cierres de escuelas, sino que también han abierto nuevas posibilidades para el aprendizaje personalizado.";"trome";"2021-03-02";"2"
"NA";"NA";"NA";"Sin embargo, esta transición no ha sido fácil. Muchos estudiantes y profesores enfrentan desafíos significativos, como la falta de acceso a internet o dispositivos adecuados, lo que genera una brecha digital preocupante. Además, el aprendizaje en línea requiere nuevas habilidades tanto para los educadores como para los alumnos.";"trome";"2021-03-02";"2"
"NA";"NA";"NA";"A pesar de estos obstáculos, la tecnología ofrece oportunidades únicas para mejorar la calidad de la educación. Herramientas interactivas y recursos digitales pueden hacer que el aprendizaje sea más atractivo y efectivo. Además, los datos analíticos recopilados por estas plataformas permiten un seguimiento más preciso del progreso estudiantil.";"trome";"2021-03-02";"2"
"NA";"NA";"NA";"En conclusión, aunque la integración de tecnología en la educación presenta desafíos, también ofrece beneficios significativos que pueden transformar el panorama educativo para mejor. Es crucial que las instituciones trabajen para superar las barreras digitales y maximicen el potencial de estas herramientas para beneficiar a todos los estudiantes.";"trome";"2021-03-02";"2"
"NA";"NA";"NA";"Por otro lado, es importante no olvidar la importancia del contacto humano en el proceso educativo. La tecnología debe ser vista como un complemento, no como un sustituto, de las interacciones cara a cara que son fundamentales para el desarrollo social y emocional de los estudiantes.";"trome";"2021-03-02";"2"
"NA";"NA";"NA";"En resumen, la tecnología tiene el poder de revolucionar la educación, pero su éxito depende de cómo se implemente y se integre en el sistema educativo existente. Con esfuerzos conjuntos entre gobiernos, instituciones educativas y comunidades, podemos asegurar que todos los estudiantes tengan acceso a una educación de calidad en este nuevo entorno digital.";"trome";"2021-03-02";"2"
