"headline";"subheadline";"author";"content";"newspaper_name";"publication_date";"page_number"
"NA";"NA";"NA";"Hoy en día, uno pensaría que el loco del martillo sería una figura del pasado. Sin embargo, la realidad es otra. En las calles de Lima, un hombre armado con un martillo ha estado causando terror entre los transeúntes. Según testigos, el sujeto se acerca a las personas y les exige dinero bajo amenaza de golpearlos con el pesado objeto. El hecho ocurrió en la calle Los Álamos, en el distrito de San Luis. La Policía ya ha iniciado una investigación para dar con el paradero del agresor.";"trome";"2021-03-02";"2"
"NA";"Habla Trome";"Ismael Lazo, Vecino de San Luis";"Estoy feliz porque finalmente terminó la cuarentena y puedo volver a trabajar. Sin embargo, me preocupa la situación económica que estamos viviendo. Muchas personas han perdido sus empleos y no saben cómo sostenerse. Es necesario que el gobierno tome medidas urgentes para ayudar a los más necesitados.";"trome";"2021-03-02";"2"
"NA";"NA";"NA";"El loco del martillo sigue generando terror en las calles de Lima. Esta vez, el sujeto habría atacado a una pareja de ancianos en la calle Los Pinos, en el distrito de Breña. La mujer resultó gravemente herida y fue llevada al hospital. El hombre, por su parte, logró escapar. Las autoridades piden ayuda a la ciudadanía para dar con el paradero del agresor.";"trome";"2021-03-02";"2"
"NA";"NA";"NA";"El loco del martillo ha sido capturado. Según informó la Policía Nacional, el sujeto fue detenido en la calle Los Girasoles, en el distrito de San Miguel. Se trata de un joven de 22 años, quien habría cometido varios robos con intimidación en las últimas semanas. El agresor fue llevado al Ministerio Público para las investigaciones correspondientes.";"trome";"2021-03-02";"2"
"NA";"NA";"NA";"El loco del martillo no actuaba solo. La Policía ha detenido a dos cómplices que ayudaban al sujeto en sus robos. Se trata de un hombre y una mujer, quienes habrían facilitado información sobre las víctimas potenciales. Los tres sujetos fueron capturados en la calle Las Camelias, en el distrito de Surquillo.";"trome";"2021-03-02";"2"
"NA";"NA";"NA";"El loco del martillo fue condenado a 15 años de prisión. El Poder Judicial emitió la sentencia contra el sujeto que sembró el terror en las calles de Lima. Durante el juicio, el agresor mostró arrepentimiento por sus acciones y pidió disculpas a las víctimas. Las familias afectadas expresaron su alivio tras conocer la sentencia.";"trome";"2021-03-02";"2"
