"headline";"subheadline";"author";"content";"newspaper_name";"publication_date";"page_number"
"NA";"NA";"NA";"NA";"trome";"2021-03-02";"2"
"El impacto de la tecnología en la educación";"NA";"Juan Pérez";"En los últimos años, hemos visto una transformación significativa en el ámbito educativo gracias a la incorporación de nuevas tecnologías. Estas herramientas no solo han cambiado la forma en que se imparte el conocimiento, sino también cómo los estudiantes interactúan con él. La pandemia del COVID-19 aceleró esta tendencia, forzando a muchas instituciones educativas a adoptar plataformas digitales para continuar con sus actividades académicas de manera remota.";"trome";"2021-03-02";"2"
"NA";"NA";"NA";"Las clases virtuales se han convertido en una realidad cotidiana. Plataformas como Zoom, Google Classroom y Microsoft Teams son ahora herramientas esenciales en el proceso educativo. Estos cambios no solo han permitido mantener la continuidad del aprendizaje durante los confinamientos, sino que también han abierto nuevas posibilidades para métodos de enseñanza más flexibles y personalizados.";"trome";"2021-03-02";"2"
"NA";"NA";"NA";"Sin embargo, esta transición digital no ha sido fácil. Muchos estudiantes y profesores enfrentan desafíos significativos, como la falta de acceso a dispositivos adecuados o una conexión a internet estable. Además, el aprendizaje en línea requiere habilidades diferentes tanto para los educadores como para los alumnos, lo que ha llevado a un periodo de adaptación.";"trome";"2021-03-02";"2"
"NA";"NA";"NA";"A pesar de estos obstáculos, la tecnología ofrece oportunidades únicas para mejorar la calidad de la educación. Herramientas interactivas y recursos digitales pueden enriquecer el contenido curricular y hacer que el aprendizaje sea más atractivo y efectivo. Además, la educación virtual permite acceder a una amplia gama de materiales y expertos de todo el mundo.";"trome";"2021-03-02";"2"
"NA";"NA";"NA";"En conclusión, aunque la integración de tecnología en la educación presenta desafíos, también ofrece beneficios significativos que pueden transformar positivamente el futuro del aprendizaje. Es crucial que las instituciones continúen invirtiendo en infraestructura digital y formación para maximizar estas oportunidades.";"trome";"2021-03-02";"2"
"NA";"NA";"NA";"Por otro lado, es importante no perder de vista la importancia del contacto humano en la educación. La tecnología debe ser una herramienta que complemente, pero no reemplace, las interacciones personales entre estudiantes y profesores.";"trome";"2021-03-02";"2"
