"headline";"subheadline";"author";"content";"newspaper_name";"publication_date";"page_number"
"NA";"NA";"NA";"NA";"trome";"2021-03-02";"2"
"El impacto de la tecnología en el trabajo remoto";"NA";"Juan Pérez";"En los últimos años, hemos visto una transformación significativa en cómo se lleva a cabo el trabajo. La pandemia aceleró esta tendencia hacia el trabajo remoto, y ahora es más común que nunca ver equipos distribuidos geográficamente colaborando de manera efectiva gracias a la tecnología.";"trome";"2021-03-02";"2"
"NA";"NA";"NA";"El clima en la ciudad ha sido inusualmente cálido para esta época del año. Se espera que las temperaturas continúen elevándose durante los próximos días, por lo que se recomienda mantenerse hidratado y evitar las horas de mayor calor.";"trome";"2021-03-02";"2"
"La importancia de la educación ambiental en las escuelas";"NA";"Laura Gómez";"Es fundamental integrar la educación ambiental en el currículo escolar para fomentar una generación más consciente del impacto humano en el planeta. A través de proyectos prácticos y teoría, los estudiantes pueden aprender a valorar y proteger su entorno.";"trome";"2021-03-02";"2"
"NA";"NA";"NA";"Anuncio público: La alcaldía invita a la comunidad a participar en la limpieza del parque central el próximo sábado. Se proporcionará todo el material necesario para la actividad.";"trome";"2021-03-02";"2"
"Avances en la lucha contra el cambio climático";"Opinión de expertos";"Dr. Carlos Martínez";"A pesar de los desafíos, hemos visto avances significativos en tecnologías limpias y políticas ambientales que prometen reducir nuestra huella de carbono. La colaboración internacional es clave para enfrentar esta crisis global.";"trome";"2021-03-02";"2"
"NA";"NA";"NA";"Recordatorio: El próximo lunes se realizará un corte programado del suministro eléctrico en el barrio de San Martín desde las 10 a.m. hasta las 2 p.m.";"trome";"2021-03-02";"2"
