"headline";"subheadline";"author";"content";"newspaper_name";"publication_date";"page_number"
"NA";"NA";"NA";"NA";"trome";"2021-03-02";"2"
"El impacto de la tecnología en la educación";"NA";"Juan Pérez";"En los últimos años, hemos visto una transformación significativa en el ámbito educativo gracias a la incorporación de nuevas tecnologías. Estas herramientas no solo han cambiado la forma en que se imparte el conocimiento, sino también cómo los estudiantes interactúan con él. La pandemia del COVID-19 aceleró esta tendencia, forzando a muchas instituciones educativas a adoptar plataformas digitales para continuar con sus actividades académicas de manera remota.";"trome";"2021-03-02";"2"
"NA";"NA";"NA";"Las clases virtuales se han convertido en una realidad cotidiana. Plataformas como Zoom, Google Classroom y Microsoft Teams son ahora parte integral del proceso educativo. Estos cambios no solo han permitido mantener la continuidad académica durante los confinamientos, sino que también han abierto nuevas posibilidades para el aprendizaje personalizado.";"trome";"2021-03-02";"2"
"NA";"NA";"NA";"Sin embargo, esta transición no ha sido fácil. Muchos estudiantes y profesores enfrentan desafíos significativos, como la falta de acceso a internet o dispositivos adecuados, lo que genera una brecha digital preocupante. Además, el aprendizaje en línea requiere nuevas habilidades tanto para los educadores como para los alumnos.";"trome";"2021-03-02";"2"
"NA";"NA";"NA";"A pesar de estos obstáculos, la tecnología ofrece oportunidades únicas para mejorar la calidad de la educación. Herramientas interactivas y recursos digitales pueden hacer que el aprendizaje sea más atractivo y efectivo. Además, la educación en línea permite una mayor flexibilidad horaria y acceso a un vasto contenido educativo global.";"trome";"2021-03-02";"2"
"NA";"NA";"NA";"En conclusión, aunque la tecnología ha presentado desafíos, también ha demostrado ser una aliada poderosa en el ámbito educativo. Es crucial que las instituciones continúen adaptándose y evolucionando para maximizar los beneficios de estas herramientas digitales.";"trome";"2021-03-02";"2"
"NA";"NA";"NA";"Por otro lado, es importante no perder de vista la importancia del contacto humano en la enseñanza. La educación no solo se trata de transmitir conocimientos, sino también de desarrollar habilidades sociales y emocionales que son fundamentales para el crecimiento personal.";"trome";"2021-03-02";"2"
"La influencia de las redes sociales en la política";"NA";"María González";"Las redes sociales han revolucionado la forma en que los políticos se comunican con sus electores. Plataformas como Twitter, Facebook e Instagram permiten a los candidatos y funcionarios públicos llegar directamente al público sin intermediarios.";"trome";"2021-03-02";"2"
"NA";"NA";"NA";"Esta nueva dinámica ha cambiado el panorama político tradicional. Ahora, las campañas electorales se llevan a cabo en gran medida en línea, donde los mensajes pueden ser compartidos y viralizados rápidamente. Esto también significa que cualquier error o declaración polémica puede tener consecuencias inmediatas.";"trome";"2021-03-02";"2"
"NA";"NA";"NA";"Además, las redes sociales han facilitado la participación ciudadana al permitir un diálogo más directo entre los políticos y el público. Los usuarios pueden expresar sus opiniones, hacer preguntas y participar en debates de manera instantánea.";"trome";"2021-03-02";"2"
"NA";"NA";"NA";"Sin embargo, este fenómeno también tiene sus desventajas. La rapidez con la que se difunden las noticias puede llevar a la propagación de información falsa o engañosa. Además, el uso excesivo de estas plataformas puede resultar en una sobrecarga informativa para los usuarios.";"trome";"2021-03-02";"2"
"NA";"NA";"NA";"En resumen, mientras que las redes sociales han democratizado el acceso a la información política y han fomentado una mayor participación ciudadana, también presentan desafíos significativos que deben ser gestionados cuidadosamente para evitar su mal uso.";"trome";"2021-03-02";"2"
