"headline";"subheadline";"author";"content";"newspaper_name";"publication_date";"page_number"
"NA";"NA";"NA";"NA";"trome";"2021-03-02";"2"
"El impacto de la tecnología en la educación";"NA";"Juan Pérez";"En los últimos años, hemos visto una transformación significativa en el ámbito educativo gracias a la incorporación de nuevas tecnologías. Estas herramientas no solo han cambiado la forma en que se imparte el conocimiento, sino también cómo los estudiantes interactúan con él. La pandemia del COVID-19 aceleró esta tendencia, forzando a muchas instituciones educativas a adoptar plataformas digitales para continuar con sus actividades académicas de manera remota.";"trome";"2021-03-02";"2"
"NA";"NA";"NA";"Las clases virtuales se han convertido en una realidad cotidiana. Plataformas como Zoom, Google Classroom y Microsoft Teams son ahora parte integral del proceso educativo. Estos cambios no solo han permitido mantener la continuidad académica durante los confinamientos, sino que también han abierto nuevas posibilidades para el aprendizaje personalizado.";"trome";"2021-03-02";"2"
"NA";"NA";"NA";"Sin embargo, esta transición no ha sido fácil. Muchos estudiantes y profesores enfrentan desafíos significativos, como la falta de acceso a internet o dispositivos adecuados, lo que genera una brecha digital preocupante. Además, el aprendizaje en línea requiere nuevas habilidades tanto para los educadores como para los alumnos.";"trome";"2021-03-02";"2"
"NA";"NA";"NA";"A pesar de estos obstáculos, la tecnología ofrece oportunidades únicas para mejorar la calidad de la educación. Herramientas interactivas y recursos digitales pueden hacer que el aprendizaje sea más atractivo y efectivo. Además, la educación en línea permite una mayor flexibilidad horaria y acceso a un vasto contenido educativo global.";"trome";"2021-03-02";"2"
"NA";"NA";"NA";"En conclusión, aunque la tecnología ha presentado desafíos, también ha demostrado ser una aliada poderosa en el ámbito educativo. Es crucial que las instituciones continúen adaptándose y evolucionando para maximizar los beneficios de estas herramientas digitales.";"trome";"2021-03-02";"2"
"NA";"NA";"NA";"Por otro lado, es importante no perder de vista la importancia del contacto humano en la enseñanza. La educación no solo se trata de transmitir conocimientos, sino también de desarrollar habilidades sociales y emocionales que son fundamentales para el crecimiento personal.";"trome";"2021-03-02";"2"
"La era digital en las aulas";"NA";"María González";"Con la llegada de la era digital, las aulas han experimentado una revolución sin precedentes. Los dispositivos electrónicos se han convertido en herramientas esenciales para los estudiantes y profesores, permitiendo un acceso más rápido y eficiente a la información.";"trome";"2021-03-02";"2"
"NA";"NA";"NA";"Las aplicaciones educativas y los recursos en línea están transformando la manera en que se enseñan las materias. Desde simulaciones interactivas hasta videos explicativos, el contenido digital ofrece una variedad de métodos para captar la atención de los estudiantes y facilitar su aprendizaje.";"trome";"2021-03-02";"2"
"NA";"NA";"NA";"Además, la tecnología permite un seguimiento más detallado del progreso académico. Los sistemas de gestión educativa proporcionan a los docentes herramientas para evaluar el rendimiento de sus alumnos de manera continua y ajustar sus métodos de enseñanza según sea necesario.";"trome";"2021-03-02";"2"
"NA";"NA";"NA";"Sin embargo, es fundamental que se mantenga un equilibrio entre el uso de la tecnología y las prácticas educativas tradicionales. La interacción personal y el desarrollo de habilidades sociales siguen siendo componentes clave en la formación integral de los estudiantes.";"trome";"2021-03-02";"2"
"NA";"NA";"NA";"En resumen, la era digital ha traído consigo numerosas ventajas para la educación, pero también desafíos que deben ser abordados con cuidado. La clave está en integrar las tecnologías de manera efectiva y equilibrada para mejorar el proceso de enseñanza-aprendizaje.";"trome";"2021-03-02";"2"
