"headline";"subheadline";"author";"content";"newspaper_name";"publication_date";"page_number"
"En agenda proyecto para despenalizar el aborto";"NA";"NA";"En casos de violación, inseminación no consentida o malformación congénita. Iniciativa legislativa presentada por la bancada del Frente Amplio ingresó a trámite documentario en el Congreso. Será revisada en comisiones. Organizaciones de mujeres respaldan la propuesta.";"Publimetro";"2016-10-13";"1"
"VIDA ANIMAL Naturaleza reciclada";"NA";"NA";"NA";"Publimetro";"2016-10-13";"1"
"‘Timochenko’ dispuesto a correcciones";"NA";"NA";"Líder de las FARC responde al triunfo del ‘No’ sobre acuerdo de paz en Colombia";"Publimetro";"2016-10-13";"1"
"INEI prepara el Censo Nacional 2017";"NA";"NA";"Funcionarios debidamente identificados verifican número de personas por hogar.";"Publimetro";"2016-10-13";"1"
"“El tiempo con tus hijos es lo más valioso”";"NA";"NA";"Jennifer Garner protagoniza junto a Kevin Spacey ‘Mi papá es un gato’, comedia sobre la paternidad que hoy se estrena en Lima.";"Publimetro";"2016-10-13";"1"
"LAS ESTADÍSTICAS DICEN QUE ACABAREMOS PENÚLTIMOS";"ANÁLISIS DE LA BBC DE LAS OCHO FECHAS QUE FALTAN EN LAS ELIMINATORIAS";"NA";"NA";"Publimetro";"2016-10-13";"1"
