"headline";"subheadline";"author";"content";"newspaper_name";"publication_date";"page_number"
"Gritan 'maldivos' a asesinos de estudiante";"NA";"I. Cirilo";"En la cocina del Departamento donde murió en Los Olivos, los vecinos gritaron 'Maldivos asesinos' a los presuntos homicidas durante la noche y entraron a la vivienda ubicada en el barrio Chicama S/N. Ambos detenidos fueron identificados como Miguel Saucedo Castro y Luis Díaz, acusado de ser el primer Marín Carrión, el 19 de febrero pasado. En horas de la noche sacaron el cadáver secuestrado en bocas de rafia y en un auto, la policía presentó que los asesinos pretendían quedar con un dinero del padre de la víctima, a lo que se les interrogaron.";"trome";"2020-03-13";"4"
"Alquilaban mototaxi para cometer sus fechorías bajo la modalidad del 'raqueteo'";"NA";"NA";"La noche del 18 de febrero, Aymeri Navarro y José Ramírez, localizaron a una vecina y le robaron su celular. Alquilaban un mototaxi para hacer de los suyos y matarían a los vecinos. Aymeri Navarro y José Ramírez, de 24 y 27 años, respectivamente, fueron detenidos por agentes del Departamento de Investigación Criminal de Lima. Ellos fueron entregados a las autoridades del Departamento de Investigación Criminal, quienes ordenaron su arresto preventivo.";"trome";"2020-03-13";"4"
"Cayó un hombre acusado de robar y amenazar a un ciudadano en el distrito de San Juan de Lurigancho";"NA";"NA";"El sujeto fue detenido por la policía tras recibir una llamada de emergencia. El agresor, quien iba a ser detenido, fue agredido por un agente de seguridad de una empresa de gas. Posteriormente, los elementos procedieron a llevarlo a un hospital para ser evaluado.";"trome";"2020-03-13";"4"
"Chapan a 'Borrado' por robar banco";"NA";"NA";"Detectives Antidrogas arrestaron a un hombre de 36 años en el Cercado de Lima, y aseguraron que habría participado en el robo de una cuenta bancaria. El sujeto tenía que manejar la cédula con la camioneta Rural en Miraflores. Para los investigadores, uno de los delincuentes, cuando el 17 de enero pasado asaltaron la agencia de Interbank de la cuadra 22 de la avenida San Luis, al comunicarse con el hombre entraron a Omar Quintero, Jr.";"trome";"2020-03-13";"4"
"Venezolanos caen por muerte de policía 'July' iba a asaltar grifo";"NA";"NA";"Una pandrera atrapada de la banda Los Rápidos de Acorredor fue detenida cuando iba a asaltar un grifo en Comas. El sujeto fue detenido por los agentes del Departamento de Investigación Criminal de Lima.";"trome";"2020-03-13";"4"
"Atrapan a maniosos";"NA";"NA";"Dos drogadictos fueron arrestados en Carabayllo por la Policía tras actuar de manera inadecuada a dos menores de edad, quienes fueron ingresados a la Brigada de Investigación Preparatoria de la Policía Metropolitana de Lima.";"trome";"2020-03-13";"4"
