"headline";"subheadline";"author";"content";"newspaper_name";"publication_date";"page_number"
"Valiente rectivo";"NA";"Monica RROISS) Rochabrum) 0 n e P P F 57 M n taneda (27) acuchillo a St primo Martin Caccire, el 19 de febrero pasado.";" ""En horas de la noche sacaron el cadaver seccionado en bolsas de rafia y en un auto. La policia pre- sume que los asesinos pretendian quedarse con un dinero del padre de la victima, al la que secues- traron. [E. Cirilo""";"trome";"2020-03-13";"4"
"Los malditos asesinos!";"NA";"NA";"Ricardo Bojorquez Alvarez (20) narro con sañ gre fria cômo matarony y des- A cuartizaron al estudiante del Economia, Martin Jesus Cacci- re Castaneda E 23. Alquilaban mototaxi para cometer sus fechorias bajo la modalidad del raqueteó.";"trome";"2020-03-13";"4"
"Detienen a peligrosa mujer de banda 'Los Rapidos del Koricancha'";"NA";"NA";"Una peligrosa mujer, de la bandá 'Los Rapidos del Koricancha', fue detenida cuando iba a asaltar un grifo en Comas. En su brasier escondía un revolver.";"trome";"2020-03-13";"4"
"Atrapan a manosos";"Dos depravados fueron arrestados en Carabayllo y la Policía los acusa de haber violado a dos menores de edad, a quienes con engaños captaron.";" ""NA""";"Bojorquez Alvarez contó como Miguel Saucedo Cas- rola utilizaba para actos delictivos, junto a su compatriota Ramirez Ontiveros. Asaltaban bajo la modalidad del 'fajeted'. La noche del 18 de febrero último, salieron a cometer sus fechorías. Localizaron una víctima, la encanaron con un pistola y le robaron su celular.";"trome";"2020-03-13";"4"
"Valiente policía fallece tras enfrentamiento";"NA";"NA";"Navarro Rios los enfrentó, pero recibió un balazo en la abdomen y falleció. Ca 'July: cerca de la estación de combustibles 'Gazel, ubicada entre las avenidas Trapichey Los Inkas. Con ella también cayó Miguel Calderón Saravial (39), Miguel. Estaban en un auto Hyundai, color negro, en cuyo interior los agentes encontraron placas de vehículos robados.";"trome";"2020-03-13";"4"
