"headline";"subheadline";"author";"content";"newspaper_name";"publication_date";"page_number"
"Los Olivos Gritan 'maldivos' a asesinos de estudiante";"NA";"I. Cirilo";"25% en la cocina del Departamento donde murió en Los Olivos. \Maldivos asesinos\"", gritaron los moradores de la zona a los presuntos homicidas cuando llegaron e ingresaron a la vivienda ubicada en el barrio Río Chirripo S.M.L. Ante los detectives de numeración de Fiscalía (abajo) y de Fiscalía (arriba) cayó Miguel Saucedo Casalenda (D7), acuchillado a primer Marzo Carrera el 19 de febrero pasado. En horas de la noche sacaron el cadáver secuestrado en bocas de rafia y en un auto, la policía presume que los asesinos pretendían quedar con un dinero del padre de la víctima, a lo que se les interrogaron. Alquilaban mototaxi para cometer sus fechorías bajo la modalidad del 'raqueteo' La noche del 18 de febrero, Aymer Herrera y José Ramírez, localizaron a una victima y le robaron su celular. Los venezolanos Aymer y José Ramírez, alquilaron un mototaxi para robar a una víctima y posteriormente portarían los cuerpos de las víctimas en un vehículo particular. Algunos testigos señalaron que el autor de la matanza intentó escapar, pero fue detenido por la Policía Metropolitana.""";"trome";"2020-03-13";"4"
"Detienen a asaltantes tras intento de fuga";"NA";"NA";"Cayendo en la trampa los asaltantes, quienes intentaron escapar, fueron detenidos por la Policía Metropolitana. El autor de la matanza, quien iba abordando como agente de seguridad de una empresa de gas, fue arrestado por la Policía Metropolitana.";"trome";"2020-03-13";"4"
"Detienen a sospechoso en asalto a banco y camión";"NA";"Paul Schaefer, Magistrado Supio 432";"Informó que el detenido cuando declaró que el chofer de una camioneta arrolló a un hombre en el Cercado de Lima. Borracho tenía una pulso en el centro de su pantalón.";"trome";"2020-03-13";"4"
"'July' iba a asaltar grifo y es detenida";"NA";"I. Cirilo";"Una peligrosa amiga de la banda Los Rápidos de Ancashar fue detenida cuando iba a asaltar un grifo en Comas. Fue trasladada en un vehículo de la Policía Metropolitana, donde intercambiaron los agentes, encontraron placa de vehículos robados. Otros tres sujetos lograron fugarse.";"trome";"2020-03-13";"4"
"Drogadictos arrestados por violación a menores";"NA";"I. Cirilo";"Dos drogadictos fueron arrestados en Carabayllo y la Policía les acusa de haber violado a dos menores de edad, a quienes los engañaron. Luego de la intervención de la Guardia Nacional Bolivariana, los dos adolescentes, a los que dicen leer con sustancias tóxicas para disparar, uno de ellos escapó y de nuevo a la Policía.";"trome";"2020-03-13";"4"
