"headline";"subheadline";"author";"content";"newspaper_name";"publication_date";"page_number"
"Se vienen más cuentas congeladas en regiones Humala considera que además de Ancash se deben intervenir otros gobiernos regionales. El Gobierno plantea cambiar la legislación para ejercer mayor control político a los gobiernos regionales. Considera que el reto de la lucha antidrogas es central al Vraem.";" ""NA""";"NA";"Se vienen más cuentas congeladas en regiones Humala considera que además de Ancash se deben intervenir otros gobiernos regionales. El Gobierno plantea cambiar la legislación para ejercer mayor control político a los gobiernos regionales. Considera que el reto de la lucha antidrogas es central al Vraem.";"gestion";"2014-06-02";"1"
"ENCUESTA NACIONAL URBANA DE GFK En norte del país se siente más que se frenó crecimiento El 53% del nivel AB considera que se crece pero más lento.";" ""NA""";"NA";"Encuesta Nacional Urbana de GfK revela que en el norte del país se percibe un freno al crecimiento. El 53% del nivel socioeconómico AB considera que, aunque sigue habiendo crecimiento, este es más lento.";"gestion";"2014-06-02";"1"
"Mandatario aún evalúa consulta sobre minis y LLAQYS Se vienen más cuentas congeladas en regiones Quedan tres postores para Gasoducto del Sur. Hasta el 20 de junio otras empresas podrán integrarse a consorcios.";" ""NA""";"NA";"El mandatario aún evalúa la posibilidad de realizar una consulta sobre minis y LLAQYS. Se anticipa que habrá más cuentas congeladas en regiones. Quedan tres postores para el Gasoducto del Sur, y hasta el 20 de junio otras empresas podrán integrarse a los consorcios.";"gestion";"2014-06-02";"1"
"Sindicatos ganan batalla en el TC. Sentencia establece que arbitraje se abrirá al viento para negociación colectiva.";" ""NA""";"NA";"Los sindicatos han ganado una importante batalla en el Tribunal Constitucional (TC). La sentencia dictada establece que el arbitraje será abierto, facilitando la negociación colectiva.";"gestion";"2014-06-02";"1"
"Es momento de créditos de plazos muy cortos. Ahora se paga mayor cuota inicial cuando se toma un crédito vehicular.";" ""NA""";"NA";"Actualmente es el momento adecuado para optar por créditos con plazos muy cortos, ya que al tomar un crédito vehicular se requiere pagar una mayor cuota inicial.";"gestion";"2014-06-02";"1"
"Alistan proyecto para desatar las inversiones. Se evalúan cambios en la Ley de Radio y Televisión.";" ""NA""";"NA";"Se está preparando un proyecto con el objetivo de impulsar las inversiones. Además, se están evaluando posibles cambios en la Ley de Radio y Televisión.";"gestion";"2014-06-02";"1"
"\Consumidores están cambiando hábitos por cautela\"" Ya se nota desaceleración, dice presidente de Cámara de Comercio de Lima.""";" ""NA""";"NA";"Los consumidores están modificando sus hábitos debido a una mayor cautela. El presidente de la Cámara de Comercio de Lima señala que ya es evidente la desaceleración económica.";"gestion";"2014-06-02";"1"
"ENCUESTA IPSOS Cambian prioridades de adultos jóvenes para ahorro El 22% de limeños de 21 a 35 años del nivel socioeconómico B ahorra para poner un negocio. Solo el 5% de los adultos jóvenes del segmento E posee una laptop.";" ""NA""";"NA";"Encuesta Ipsos revela que las prioridades de ahorro entre los adultos jóvenes están cambiando. El 22% de limeños de 21 a 35 años, pertenecientes al nivel socioeconómico B, ahorra con el objetivo de iniciar un negocio. Solo el 5% de los adultos jóvenes del segmento E posee una laptop.";"gestion";"2014-06-02";"1"
