"headline";"subheadline";"author";"content";"newspaper_name";"publication_date";"page_number"
"Se vienen más cuentas congeladas en regiones";"NA";"NA";"Humala considera que además de Ancash se deben intervenir otros gobiernos regionales. El Gobierno plantea cambiar la legislación para ejercer mayor control político a los gobiernos regionales. Considera que el reto de la lucha antidrogas es central al Vraem. No tienen nada de malo. Defendió reunión de Nadine con ministros.";"gestion";"2014-06-02";"1"
"ENCUESTA NACIONAL URBANA DE GFK";"En norte del país se siente más que se frenó crecimiento";"NA";"El 53% del nivel AB considera que se crece pero más lento. 54% cree que situación económica del hogar será la misma en próximos 12 meses.";"gestion";"2014-06-02";"1"
"Consumidores están cambiando hábitos por cautela";"NA";"NA";"Ya se nota desaceleración, dice presidente de Cámara de Comercio de Lima.";"gestion";"2014-06-02";"1"
"ENCUESTA IPSOS Cambian prioridades de adultos jóvenes para ahorro";"NA";"NA";"El 22% de limeños de 21 a 35 años del nivel socioeconómico B ahorra para poner un negocio. Solo el 5% de los adultos jóvenes del segmento E posee una laptop.";"gestion";"2014-06-02";"1"
"DirecTV crecerá 25% en clientes por Mundial";"NA";"NA";"Espera tener más de 300 mil suscriptores.";"gestion";"2014-06-02";"1"
