"headline";"subheadline";"author";"content";"newspaper_name";"publication_date";"page_number"
"Se vienen más cuentas congeladas en regiones";"Humala considera que además de Ancash se deben intervenir otros gobiernos regionales. El Gobierno plantea cambiar la legislación para ejercer mayor control político a los gobiernos regionales. Considera que el reto de la lucha antidrogas es entrar al Vraem";"NA";"Se vienen más cuentas congeladas en regiones Humala considera que además de Ancash se deben intervenir otros gobiernos regionales. El Gobierno plantea cambiar la legislación para ejercer mayor control político a los gobiernos regionales. Considera que el reto de la lucha antidrogas es entrar al Vraem.";"gestion";"2014-06-02";"1"
"Encuesta Nacional Urbana de GFK";"En norte del país se siente más que se frenó crecimiento El 53% del nivel AB considera que se crece pero más lento";"NA";"P.2 ENCUESTA NACIONAL URBANA DE GFK En norte del país se siente más que se frenó crecimiento El 53% del nivel AB considera que se crece pero más lento.";"gestion";"2014-06-02";"1"
"Quedan tres postores para Gasoducto del Sur";"Hasta el 20 de junio otras empresas podrán integrarse a consorcios";"NA";"P.16-17 Quedan tres postores para Gasoducto del Sur Hasta el 20 de junio otras empresas podrán integrarse a consorcios.";"gestion";"2014-06-02";"1"
"Sindicatos ganan batalla en el TC";"Sentencia establece que arbitraje se obliga a respetar negociación colectiva";"NA";"P.19 Sindicatos ganan batalla en el TC Sentencia establece que arbitraje se obliga a respetar negociación colectiva.";"gestion";"2014-06-02";"1"
"Alistan proyecto para destrabar las inversiones";"Se evalúan cambios en la Ley de Radio y Televisión “Consumidores están cambiando hábitos por cautela” Ya se nota desaceleración, dice presidente de Cámara de Comercio de Lima";"NA";"P.20 Alistan proyecto para destrabar las inversiones Se evalúan cambios en la Ley de Radio y Televisión “Consumidores están cambiando hábitos por cautela” Ya se nota desaceleración, dice presidente de Cámara de Comercio de Lima.";"gestion";"2014-06-02";"1"
"Brasil 2014";"DirecTV crecerá 25% en clientes por Mundial Espera tener más de 300 mil suscriptores";"NA";"P.10 BRASIL 2014 DirecTV crecerá 25% en clientes por Mundial Espera tener más de 300 mil suscriptores.";"gestion";"2014-06-02";"1"
