"headline";"subheadline";"author";"content";"newspaper_name";"publication_date";"page_number"
"NA";"NA";"NA";"El diario de economía y negocios del Perú gestion.pe VIERNES 12 DE JULIO DEL 2019 Año 29. Número 8038 Precio: S/ 3.00 Vía aérea: S/ 3.50 # GESTIÓN ## FMI advierte riesgo de que 60% de afiliados a ONP no tengan pensión Informe proyecta que cerca del 50% de los que contribuyeron en últimos cinco años al Sistema Nacional de Pensiones no alcanzarían los 20 años de aporte y por tanto se quedarían sin pensión. El Fondo Monetario proyecta que en los próximos años los afiliados al Sistema Privado de Pensiones se jubilarían con un tercio de su sueldo como trabajadores activos. Considera crucial estimar los niveles de pensiones futuros para realizar reformas y que los trabajadores tomen decisiones bien informados.";"gestion";"2019-07-12";"1"
"NA";"Población participará en monitoreo ambiental de Tía María";"Francisco Ísmodes";"También podrá presidir el comité para fiscalizar y controlar el desarrollo de la inversión minera que hará Southern. Se contemplan varias mesas de diálogo según las preocupaciones que genera el proyecto, dijo el ministro de Energía y Minas, Francisco Ísmodes.";"gestion";"2019-07-12";"1"
"NA";"Cae el precio mayorista del pollo, pero no a igual ritmo en mercados";"NA";"En los últimos siete días del mes, el margen comercial entre el precio minorista y mayorista fue de 101%, según el Minagri.";"gestion";"2019-07-12";"1"
"NA";"“A la gran población no le preocupan ‘los cuellos blancos’, sino si su quiosco vende”";"Experto en marketing";"Experto en marketing dice que las clases medias altas y la gran población son dos mundos que no se miran. Hoy la clase que trabaja para subsistir busca reconocimiento social.";"gestion";"2019-07-12";"1"
"NA";"Subirá en 50% stock de metros cuadrados de oficinas coworking";"NA";"NA";"gestion";"2019-07-12";"1"
"NA";"BCR ve probable que demanda interna crezca menos de lo previsto";"NA";"NA";"gestion";"2019-07-12";"1"
