"headline";"subheadline";"author";"content";"newspaper_name";"publication_date";"page_number"
"Se vienen más cuentas congeladas en regiones";"Humala considera que además de Ancash se deben intervenir otros gobiernos regionales. El Gobierno plantea cambiar la legislación para ejercer mayor control político a los gobiernos regionales.";" ""NA""";" ""El mandatario aún evalúa consulta sobre milis y la clt. Se vienen más cuentas congeladas en regiones Humala considera que además de Ancash se deben intervenir otros gobiernos regionales. El Gobierno plantea cambiar la legislación para ejercer mayor control político a los gobiernos regionales. Considera que el retiro de la lucha antirrogas es entrar al Vraem.""";"gestion";"2014-06-02";"1"
"Quedan tres postores para Gasoducto del Sur";"Hasta el 20 de junio otras empresas podrán integrarse a consorcios.";" ""NA""";" ""Quedan tres postores para Gasoducto del Sur. Hasta el 20 de junio otras empresas podrán integrarse a consorcios.""";"gestion";"2014-06-02";"1"
"Sindicatos ganan batalla en el TC";"Sentencia establece que al biraje se abrira un depósito para negociaciones.";" ""NA""";" ""Sindicatos ganan batalla en el TC. Sentencia establece que al biraje se abrirá un depósito para negociaciones.""";"gestion";"2014-06-02";"1"
"Llama Lima Promuro a Bianquiazul plantear emisión de bonos para salvar a Lima";"Llama Lima Promuro a Bianquiazul plantear emisión a nombre del club por US$ 4 mls.";" ""NA""";" ""Emidirán bonos para salvar a Lima. Llama Lima Promuro a Bianquiazul plantear emisión a nombre del club por US$ 4 mls.""";"gestion";"2014-06-02";"1"
"Alistan proyecto para destrabar las inversiones";"Se evalúan cambios en la Ley de Radio y Televisión.";" ""NA""";" ""Lucha contra ‘permisología’. Alistan proyecto para destrabar las inversiones. Se evalúan cambios en la Ley de Radio y Televisión.""";"gestion";"2014-06-02";"1"
"Consumidores están cambiando hábitos por cautela";"Ya se nota desaceleración, dice presidente de Cámara de Comercio de Lima.";" ""Jorge Von Wedemeyer""";" ""Consumidores están cambiando hábitos por cautela. Ya se nota desaceleración, dice presidente de Cámara de Comercio de Lima.""";"gestion";"2014-06-02";"1"
