"headline";"subheadline";"author";"content";"newspaper_name";"publication_date";"page_number"
"Vanessa denuncia por violencia psicológica y acusa de amor interesado a Forsyth";"Me utilizó para ser alcalde";"NA";"Ante Corte Superior de Justicia, actriz contó que agresiones de 'Ken' empezaron 5 días después de su matrimonio. Según abogada de la Terkes, exarquero de Alianza la comparaba en la intimidad con sus anteriores parejas.";"ojo";"2019-06-01";"1"
"Director Jaime Asán Dominguez";"BOMBAZO DE PIZARRO A GARECA SE DEFIENDE Y LO CALIFICA DE SER PURA MILONGA";"NA";"Deporte • PÁG. 19 HOY SUPLEMENTO EN MODO VACILÓN • PÁGS. 11-14 LIMA, SÁBADO 1 DE JUNIO DE 2019 | OJO AL WHATSAPP ENVÍA TU MENSAJE 942400667 () S/ 0.70";"ojo";"2019-06-01";"1"
"DiarioOjo";"NA";"NA";"Lima, sábado 1 de junio de 2019 | OJO AL WHATSAPP ENVÍA TU MENSAJE 942400667 () S/ 0.70 www.diarioojoe.com @diarioojoe DiarioOjo OJOSHOW • PÁG. 17 LA PRIMERA DISCUSIÓN FUE POR WASAPEAR CON SU EX CLAUDIA RAMÍREZ EL DÍA DE LA BODA leonnico@hu-berlin.de";"ojo";"2019-06-01";"1"
"Dirán 'sí' a cuestión de confianza, según Vizcarra";"Congresistas arrugarán política";"NA";"Según Vizcarra, congresistas arrugarán política • PÁG. 8 www.diarioojoe.com @diarioojoe DiarioOjo";"ojo";"2019-06-01";"1"
"DiarioOjo OJOSHOW";"La primera discusión fue por wasapear con su ex Claudia Ramírez el día de la boda";"NA";"leonnico@hu-berlin.de";"ojo";"2019-06-01";"1"
