"headline";"subheadline";"author";"content";"newspaper_name";"publication_date";"page_number"
"Japoneses celebran D칤a del Inodoro";"NA";"NA";"Hoy, 10 de noviembre, es el D칤a no oficial del inodoro. La responsable es la Asociaci칩n Japonesa del Inodoro. El motivo es que los n칰meros 11/10 se pueden leer en japon칠s como 'ii-to ire' (buen inodoro).";"ojo";"2020-11-10";"7"
"Surfistas encuentran 'C치psula del tiempo'";"NA";"NA";"Dos surfistas irlandeses descubrieron una c치psula del tiempo que fue enterrada bajo el hielo del Polo Norte en 2018. Los dise침adores de la c치psula eran rusos que viajaron hasta el Polo Norte para esconderla dentro de un bloque de hielo gigante, que esperaban que se derritiera dentro de 50 a침os.";"ojo";"2020-11-10";"7"
"Halla diamante que vale miles de d칩lares";"NA";"NA";"Un habitante de Carolina del Norte descubri칩 un precioso diamante de 4,5 quilates en el parque estatal Crater of Diamonds, el 칰nico lugar del mundo con verdaderos diamantes abierto al p칰blico. El hombre aprovech칩 que las fuertes lluvias crearon condiciones ideales para la b칰squeda de gemas y tras horas de b칰squeda encontr칩 la pieza valorizada en varios miles de d칩lares.";"ojo";"2020-11-10";"7"
"Sab칤as que... La raz칩n por la miel es tan f치cil de digerir es porque ya ha sido digerida por las abejas.";"NA";"NA";"Somos la mejor opci칩n del mercado, contamos con la m치s moderna capacidad instalada, calidad de impresi칩n de nivel internacional, costos competitivos y llegamos a todos los puntos de venta desde nuestros centros de distribuci칩n ubicados en todos los distritos de Lima y departamentos del Per칰. Nuestros Servicios: - Impresi칩n: - Diarios - Suplementos - Encartes - Cat치logos - Retoque Fotogr치fico (se incluye con el servicio de impresi칩n) - Refilado de diferentes piezas gr치ficas - Transporte: Rutas implementadas - 48 p치ginas full color Centro de impresi칩n Lima - 32 p치ginas full color Centro de impresi칩n Provincias Cont치ctenos: 游 981 599 209 九괦잺 sandra.meono@comercio.com.pe";"ojo";"2020-11-10";"7"
"Content";"NA";"NA";"NA";"ojo";"2020-11-10";"7"
