"headline";"subheadline";"author";"content";"newspaper_name";"publication_date";"page_number"
"FIXTURE PERÚ RUSIA 2018 ESTE LUNES RECLAME GRATIS FIXTURE DEL MUNDIAL RUSIA 2018";"NA";"NA";"Perú21 @peru21noticias.de DIRECTORA PERIODÍSTICA: CECILIA VALENZUELA AÑO XV N° 5766 SÁBADO 2 DE JUNIO DEL 2018 S/1.00 PÁGS. 10 Y 15 La joven murió. Hace 38 días fue quemada en bus. Para 2020, saldrán libres 976 presos por agresión sexual. BUENA NOTICIA Bajan tarifas de teléfonos PÁG. 11 EXPANSIÓN DE PROYECTO Toromocho va, pero con conflicto PÁGS. 2 Y 3 LIMA AL REVÉS Corredores viales de mal en peor PÁG. 16 EYVI ÁGREDA NO RESISTIÓ SALVAJE ATAQUE DE ACOSADOR CARLOS HUALPA www.peru21.pe @peru21noticias Perú21";"peru21";"2018-06-02";"1"
"BUENA NOTICIA Bajan tarifas de teléfonos";"NA";"NA";"Bajan tarifas de teléfonos PÁG. 11";"peru21";"2018-06-02";"1"
"EYVI ÁGREDA NO RESISTIÓ SALVAJE ATAQUE DE ACOSADOR CARLOS HUALPA";"NA";"Carlos Hualpa";"EYVI ÁGREDA NO RESISTIÓ SALVAJE ATAQUE DE ACOSADOR CARLOS HUALPA www.peru21.pe @peru21noticias Perú21";"peru21";"2018-06-02";"1"
"Para 2020, saldrán libres 976 presos por agresión sexual";"NA";"NA";"Para 2020, saldrán libres 976 presos por agresión sexual.";"peru21";"2018-06-02";"1"
"EXPANSIÓN DE PROYECTO Toromocho va, pero con conflicto";"NA";"NA";"EXPANSIÓN DE PROYECTO Toromocho va, pero con conflicto PÁGS. 2 Y 3";"peru21";"2018-06-02";"1"
"LIMA AL REVÉS Corredores viales de mal en peor";"NA";"NA";"LIMA AL REVÉS Corredores viales de mal en peor PÁG. 16";"peru21";"2018-06-02";"1"
