"headline";"subheadline";"author";"content";"newspaper_name";"publication_date";"page_number"
"Volumen 3.000 S/.0.70";"NA";"NA";"Multitud ovacionó a las chicas del vóley";"peru21";"2013-08-07";"1"
"Sicario a los 13 'Hormiguita' está implicado en tres crímenes y fue detenido ayer";"NA";"NA";"Niño fue capturado en el norte por peligrosa banda del 'Cojo Mame'.";"peru21";"2013-08-07";"1"
"Vía crucis por la huelga médica";"NA";"NA";"NA";"peru21";"2013-08-07";"1"
"Se archivó el caso Ciro Castillo";"NA";"NA";"NA";"peru21";"2013-08-07";"1"
"San Martín investigado por reunión con jueza y ministros";"NA";"NA";"NA";"peru21";"2013-08-07";"1"
"Especialista en Administración y Seguridad de Linux Oracle Database 11g SQL Fundamentos I Manipulación de datos y creación de aplicaciones para bases de datos";"NA";"NA";"Universidad Tecnológica del Perú www.utp.edu.pe";"peru21";"2013-08-07";"1"
