"headline";"subheadline";"author";"content";"newspaper_name";"publication_date";"page_number"
"CIUDAD GOBIERNO ANUNCIA PLAN DE CIEN DÍAS PARA COMBATIR LA INSEGURIDAD CIUDADANA";"NA";"CÉSAR MARTÍNEZ AZANZA cmartinez@peru21.com";"En los próximos cien días, el Ministerio del Interior restaurará el patrullaje integrado entre la Policía y el serenazgo en siete ciudades. Para esta tarea destinará al menos 800 agentes. En ese plazo, también se ejecutarán operativos encubiertos para tratar de acabar con la corrupción sancionando tanto al que corrompe como al que se deja corromper. Además, se implementarán cuatro pilotos del programa Barrio Seguro en zonas con graves problemas de seguridad, en las que se incrementará la presencia policial. Eso puntos contarán con más programas sociales y educativos, en los que intervendrán diversos ministerios y autoridades locales. En los siguientes cien días también se pretende incorporar 500 nuevos detectives a las unidades especializadas de investigación criminal. Del mismo modo, se creará un equipo especial de inteligencia para casos de alta complejidad. Estos son algunos anuncios hechos ayer por el ministro del Interior, Carlos Basombrio, como parte del plan de los cien días, tiempo en el que, además, se ejecutarán 30 megaoperativos en todo el país, se instalarán GPS en patrulleros—para fiscalizar el recorrido que estos hacen—y se actualizará semanalmente la lista de los más buscados, tal como se viene haciendo. MÁS MEDIDAS Otro aspecto importante es que se declarará en emergencia la sanidad y salud policial. También se adelantará el quinto bono al personal policial. Basombrio aclaró que el plan tiene como espíritu"" transmitir a la ciudadanía que se ha roto la inercia. ""No podemos asegurarte a la ciudadanía que de la noche a la mañana el delito va a desaparecer, pero queremos que en estos cien días quede claro que las instituciones que tienen que luchar contra el delito van a tener una nueva actitud"", enfatizó. Sobre estos anuncios, el presidente de la República, Pedro Pablo Kuczynski, sostuvo que personalmente supervisará el cumplimiento de las metas y objetivos. Además, recalcó que acudirá trimestralmente al Conasec o cada vez que lo amerite. Sostuvo que se mejorará la situación económica de la Policía a partir de setiembre ""haciendo que los bonos sean pensionables"". También indicó que se está trabajando coordinadamente con el Poder Judicial y la Fiscalía ""para que las sentencias se cumplan y no se suelte a los criminales después de tres semanas y, luego, vuelvan a matar"". De otro lado, respecto a los hampones que salieron en libertad debido a resoluciones judiciales y que luego participaron en el asesinato de una cambista de San Isidro, Basombrio aclaró que no señalará ""con el dedo"" a ningún responsable. No obstante, dijo que el presidente del Poder Judicial dará las medidas necesarias para que estos casos no se repitan. Agregó que mejorarán la coordinación entre la PNP, la Fiscalía y el Poder Judicial. A FAVOR DE LA SEGURIDAD. Señalan que propuestas contribuirán a reducir el índice de criminalidad.""";"peru21";"2016-08-11";"16"
"SEÑALAN QUE PROPUESTAS CONTRIBUIRÁN A REDUCIR EL ÍNDICE DE CRIMINALIDAD";"NA";"NA";"SABÍA QUE William Pesantes Tenorio fue detenido el martes en el Cercado de Lima, pues figuraba en la última lista de los más buscados. Sin embargo, fue liberado la mañana de ayer. Fuentes de la Policía confirmaron que un juzgado de Huancayo dispuso, el 2 de agosto, el levantamiento de la orden de captura, lo que no fue comunicado a tiempo a la PNP. Estamos convencidos de que solo un trabajo integrado nos llevará a reducir la violencia"". Fernando Zavala Primer ministro""";"peru21";"2016-08-11";"16"
"PERÚ21 TE REGALA ÁLBUM Y FIGURAS";"NA";"NA";"Serán entregados mañana con tu diario loable. Publicidad promueve el cuidado de los animales. ¿Te gustaría ayudar a los animales en abandono y no sabe cómo hacerlo? Entonces compre mañana su diario Perú21, que saldrá con el álbum Amici Cuccioliotti, de la editorial Panini, más 12 figuritas, que forman parte de una campaña solidaria en beneficio de los animales. Con las ventas, dicha empresa entregará unas cien mil raciones de comida a cuatro instituciones que se encargan de velar por los animales. Entre ellas figura la Asociación Patitas, que hace ocho años rescata canes abandonados. En su local ubicado en Pachacámac atiende a 85 perritos, los que esperan ser adoptados. También se encuentra el albergue de Vida Digna, que ofrece cobijo a perros rescatados del maltrato y del olvido. Tiene, además, un programa para el cuidado de caballos. Las otras beneficiadas son la Asociación Peruana de Protección a los Animales y la Reserva Ecológica Chaparrí.";"peru21";"2016-08-11";"16"
"PODRÍAN SER ADICTOS";"Menores en riesgo por Internet";"NA";"Un millón 200 mil adolescentes peruanos, es decir el 16.2% de estos, están en riesgo de presentar una conducta adictiva a internet, tal como sucede con las drogas, según una investigación de salud mental. El estudio fue realizado por la fundación Mapfre, Prevensis y el Instituto de Opinión Pública de la Universidad Católica. Se aplicaron encuestas a menores de 13 a 17 años de colegios de Lima y Arequipa.";"peru21";"2016-08-11";"16"
"DEBÍAN S/500 MIL EN PAPELETAS";"NA";"NA";"Cinco vehículos de transporte público que circulaban por la capital pese a registrar deudas en papeletas por un total de medio millón de soles fueron enviados ayer al depósito tras un operativo de la Municipalidad de Lima. Se trata de las unidades de placas A0H-750 ($/178 mil), A4K-712 ($/140 mil), D9Y-092 ($/81 mil), A3L-723 ($/68 mil) y A2S-738 ($/46 mil). Fueron intervenidas en la Av. Angamos.";"peru21";"2016-08-11";"16"
