"headline";"subheadline";"author";"content";"newspaper_name";"publication_date";"page_number"
"Brexit Agreement Unconvincing to Brussels";"NA";"NA";"El comité de la Comisión Europea encargado del 'Brexit' aseguró ayer que la propuesta presentada por el primer ministro británico Johnson no constituye un 'base de un acuerdo' para elevar la salida de Reino Unido del bloque comunitario. Los integrantes del comité consideran que no se han abordado 'los cuestiones reales que deben resolverse si se suprimir la salvaguarda transitoria'. Este punto siempre ha sido el principal obstáculo para el divorcio de Londres con Bruselas. El líder conservador afirma que no existen condiciones mantenidas en el acuerdo del Norte (país de Reino Unido) e Irlanda del Norte (país de Irlanda). Además, propone que los controles fiscales se realicen en los locales británicos.";"publimetro";"2019-10-04";"8"
"Trump Calls for China to Investigate Biden";"NA";"NA";"En medio del escándalo por el inicio político, el presidente estadounidense Donald Trump sostuvo que tanto China como China, deben investigar a Joe Biden, quien es el demócrata favorito para disputar una posible reelección en el 2020. En declaraciones a la prensa, Trump reconoció a su par chino, Xi Jinping, exministro también a su hijo Hunter Biden por sus negocios en el país. De acuerdo a The New Yorker, Hunter Biden ha brindado sobornos de un magnate chino en beneficio de su compañía. En Estados Unidos, es considerado ilegal pedir ayuda extranjera en una elección.";"publimetro";"2019-10-04";"8"
"Coca-Cola's Environmental Initiative in Ecuador";"NA";"NA";"La compañía estadounidense Coca-Cola anunció ayer que dejará de emplear en las botellas de plástico sus logotipos en Ecuador, país donde el consumo de las botellas de plástico es muy alto. Las botellas de plástico son consideradas una contaminación ambiental y su uso está prohibido en el país. 'Es el primer paso hacia la eliminación de materiales no reciclables', afirmó el vicepresidente de la empresa, 'estamos trabajando en un plan para eliminar el uso de plástico en el mercado', indicó el ejecutivo.";"publimetro";"2019-10-04";"8"
"Facebook's Political Ad Ban";"NA";"NA";"El sitio social más utilizado en el world, con más de 300 millones de usuarios, anunció ayer que eliminará los anuncios políticos, como el de Donald Trump, en su plataforma. 'No queremos que los anuncios políticos influyan en las decisiones de los ciudadanos', dijo el director general de Facebook, Mark Zuckerberg.";"publimetro";"2019-10-04";"8"
"Bolsonaro Celebrates Crime Reduction in Brazil";"NA";"NA";"El presidente brasileño Jair Bolsonaro celebró ayer que las políticas 'inflexibles' de su administración han permitido reducir el número de asesinatos registrados este año. Durante un acto en Brasilia, el político, tras descartar el aumento de la criminalidad, anunció que hasta julio se han reportado 1,679 asesinatos en el país, lo que representa un 24,6% menos que el mismo período de 2018. Bolsonaro recomendó concentrar para los políticos.";"publimetro";"2019-10-04";"8"
"Gasoline Price Hike Sparks Protests in Ecuador";"NA";"NA";"Alarma del precio de la gasolina ha paralizado el país. Nuevos precios Las agencias de transporte, como el gobierno ecuatoriano, han anunciado que el precio de la gasolina ha aumentado en todas las ciudades del país. Esta medida se debe a que el presidente Lenin Moreno anunció el paro de motociclistas en una serie de medidas económicas por la necesidad de ahorro fiscal. Entre ellas, se presentó la eliminación de subsidios a la gasolina, lo que inflará un aumento en el precio del combustible. De esta manera, se pro- tendrá elevar los ingresos del Estado y ahorrar $1400 millones de dólares para pagar la deuda que el país tiene con el Banco Mundial. Aten- ción, FMI. Esta medida que trans- portistas y universidades sobran a las calles de Qui- nta Manabí, se ha ca- das fiestas suspendidas y las autoridades ya han deja- do de circular la protesta cíclica y se extenderá a otras ciudades, alcanzando nive- les violentos. Un edificio fue puesto por el Ejecutivo para res- trinuir eventos cercados, como el de la librería, en acción a los ciudadanos y no ensuciar previa las mé- dicas de contaminación. De acuerdo a la minis- terio de Gobierno, Mario Raul Romeo, hay 19 detenidos hasta el momento. No se están con una cifra posi- sionada en las entran- duras contra la Policía. El gobierno de Moreno ha argumentado que las medidas son necesarias para levantar la economía de arriba del país.";"publimetro";"2019-10-04";"8"
