"headline";"subheadline";"author";"content";"newspaper_name";"publication_date";"page_number"
"LAS ESTADÍSTICAS DICEN QUE ACABAREMOS PENÚLTIMOS ANÁLISIS DE LA BBC DE LAS OCHO FECHAS QUE FALTAN EN LAS ELIMINATORIAS";"NA";"NA";"Las estadísticas indican que acabaremos en el penúltimo lugar según un análisis de la BBC sobre las ocho fechas restantes en las eliminatorias.";"publimetro";"2016-10-13";"1"
"En agenda proyecto para despenalizar el aborto En casos de violación, inminación no consentida o malformación congénita";"NA";"NA";"Se discutirá en el Congreso un proyecto presentado por la bancada de Fuerza Popular que busca despenalizar el aborto en casos de violación, iminación no consentida o malformación congénita. Será revisado en comisiones.";"publimetro";"2016-10-13";"1"
"NA";"NA";"NA";"O lo que se haga de mejor es lo que realmente propone.";"publimetro";"2016-10-13";"1"
"NA";"NA";"NA";"Vida Animal: Naturaleza reciclada";"publimetro";"2016-10-13";"1"
"NA";"NA";"NA";"INEI prepara el Censo Nacional 2017";"publimetro";"2016-10-13";"1"
"¡Aló! Te tengo una buena noticia";"NA";"NA";"El tiempo con tus hijos es lo más valioso.";"publimetro";"2016-10-13";"1"
