"headline";"subheadline";"author";"content";"newspaper_name";"publication_date";"page_number"
"Las estadísticas dicen que acabaremos penúltimos: análisis de la BBC de las ocho fechas que faltan en las Eliminatorias";"NA";"NA";"LAS ESTADÍSTICAS DICEN QUE ACABAREMOS PENÚLTIMOS ANÁLISIS DE LA BBC DE LAS OCHO FECHAS QUE FALTAN EN LAS ELIMINATORIAS.";"publimetro";"2016-10-13";"1"
"Iniciativa legislativa para despenalizar el aborto presentada por la bancada del Frente Amplio";"NA";"NA";"En agenda proyecto para despenalizar el aborto Iniciativa legislativa presentada por la bancada del Frente Amplio ingresó a trámite documentario en el Congreso. Organizaciones de mujeres respaldan la propuesta.";"publimetro";"2016-10-13";"1"
"Naturaleza reciclada: esculturas con piezas de autos";"NA";"NA";"Usando piezas de autos desechadas y otros materiales, un artista portugués crea llamativas esculturas.";"publimetro";"2016-10-13";"1"
"'Timochenko' dispuesto a correcciones tras el triunfo del 'No' sobre acuerdo de paz en Colombia";"NA";"NA";"‘Timochenko’ dispuesto a correcciones Líder de las FARC responde al triunfo del ‘No’ sobre acuerdo de paz en Colombia.";"publimetro";"2016-10-13";"1"
"INEI prepara el Censo Nacional 2017";"NA";"NA";"INEI prepara el Censo Nacional 2017 Funcionarios debidamente identificados verifican número de personas por hogar.";"publimetro";"2016-10-13";"1"
"Operadoras de telefonía sacan planes especiales para discapacitados";"NA";"NA";"¡Aló! Te tengo una buena noticia Operadoras de telefonía sacan planes especiales para discapacitados.";"publimetro";"2016-10-13";"1"
"Jennifer Garner protagoniza 'Mi papá es un gato', comedia sobre la paternidad";"NA";"NA";"“El tiempo con tus hijos es lo más valioso” Jennifer Garner protagoniza junto a Kevin Spacey Mi papá es un gato, comedia sobre la paternidad que hoy se estrena en Lima.";"publimetro";"2016-10-13";"1"
