"headline";"subheadline";"author";"content";"newspaper_name";"publication_date";"page_number"
"Análisis de las Eliminatorias";"NA";"BBC";"Las estadísticas dicen que acabaremos penúltimos según el análisis de la BBC de las ocho fechas que faltan en las eliminatorias.";"publimetro";"2016-10-13";"1"
"Iniciativa legislativa para despenalizar el aborto";"NA";"NA";"Proyecto presentado por la bancada del Frente Amplio ingresó a trámite documentario en el Congreso. Organizaciones de mujeres respaldan la propuesta.";"publimetro";"2016-10-13";"1"
"Naturaleza reciclada";"NA";"NA";"Usando piezas de autos desechadas y otros materiales, un artista portugués crea llamativas esculturas.";"publimetro";"2016-10-13";"1"
"'Timochenko' dispuesto a correcciones";"Líder de las FARC responde al triunfo del ‘No’ sobre acuerdo de paz en Colombia";"NA";"‘Timochenko’, líder de las FARC, responde al triunfo del ‘No’ sobre el acuerdo de paz en Colombia.";"publimetro";"2016-10-13";"1"
"INEI prepara el Censo Nacional 2017";"NA";"NA";"Funcionarios debidamente identificados verifican número de personas por hogar para el Censo Nacional 2017.";"publimetro";"2016-10-13";"1"
"Operadoras de telefonía sacan planes especiales para discapacitados";"¡Aló! Te tengo una buena noticia";"NA";"Operadoras de telefonía sacan planes especiales para discapacitados.";"publimetro";"2016-10-13";"1"
"'El tiempo con tus hijos es lo más valioso'";"Jennifer Garner protagoniza junto a Kevin Spacey Mi papá es un gato, comedia sobre la paternidad que hoy se estrena en Lima";"NA";"Jennifer Garner protagoniza junto a Kevin Spacey 'Mi papá es un gato', una comedia sobre la paternidad que hoy se estrena en Lima.";"publimetro";"2016-10-13";"1"
