"headline";"subheadline";"author";"content";"newspaper_name";"publication_date";"page_number"
"TRENDING TOPICS Estos fueron algunos de los temas que más se comentaron ayer en Twitter.";"NA";"NA";"#CocaCola La compañía estadounidense Coca-Cola anunció ayer que dejará de emplear anillas de plástico en sus latas vendidas en Europa occidental a partir del próximo año. En su lugar, utilizará cartón con certificación forestal para cumplir sus objetivos en materia de sostenibilidad. Las anillas han sido por años símbolo de la contaminación de mares. \#CocaCola es igual a montañas de plástico en todo el mundo\"", tuiteó ayer la cuenta @ledesmagarin. #Facebook La red social fue multada ayer con más de 280.000 dólares por la Junta de Protección de Datos Personales de Turquía. El motivo: Facebook vulneró los datos privados de miles de usuarios turcos, al exponer su nombre, sexo, fecha de nacimiento, estado civil y ubicación geográfica. \""Sería una pena que no arreglemos un sistema que deja a las grandes compañías como #facebook participar en prácticas ilegales, como pisotear los derechos de privacidad de los consumidores\"", escribió @AlbeCastedo10. #Glaciares La Dirección General de Aguas de Chile informó ayer que los glaciares de Chile han registrado un retroceso en sus masas del 8% desde el 2014, a causa del calentamiento global. Esto representa la desaparición de casi 2.900 kilómetros cuadrados de superficie glaciar. \""Según la ONU, mil millones de personas se verán afectadas para 2050 por la desaparición de los #glaciares\"", escribió en Twitter @aggregatte.""";"publimetro";"2019-10-04";"8"
"Estado de excepción declarado en Ecuador";"NA";"NA";"Caos en las calles de todas las ciudades. Aumento del precio de la gasolina ha paralizado al país. Nuevos precios Tras aplicarse las nuevas medidas, el precio del galón de gasolina pasó de 1,85 a 2,40 dólares, mientras el de diésel subió de 1,83 a 2,30 dólares. Las organizaciones sindicales han advertido a los ciudadanos que no dejan sin efecto este aumento a que haya compensaciones.";"publimetro";"2019-10-04";"8"
"Acuerdo del 'Brexit' no convence a Bruselas";"NA";"NA";"El comité de la Eurocámara encargado del 'Brexit' aseguró ayer que la propuesta presentada por el primer ministro Boris Johnson no constituye la \base de un acuerdo\"" para ejecutar la salida de Reino Unido del bloque comunitario. Los integrantes del comité cuestionan que no se han abordado \""las cuestiones reales que deben resolverse si se suprime la salvaguarda irlandesa\"". Este punto siempre ha sido el principal obstáculo para el divorcio de Londres con Bruselas. El líder conservador plantea de que no existan controles fronterizos entre Irlanda del Norte (país del Reino Unido) e Irlanda (miembro de la UE). Además, propone que los controles físicos se realicen en los locales comerciales. Los eurodiputados, en cambio, sostienen que la medida presenta ciertos vacíos que deben resolverse.""";"publimetro";"2019-10-04";"8"
"Brasil: Bolsonaro celebra reducción de asesinatos";"NA";"NA";"El presidente brasileño Jair Bolsonaro señaló ayer que las políticas \inflexibles\"" de su administración han permitido reducir el número de asesinatos registrados este año. Durante un acto en Brasilia, el político ultraderechista y el ministro de Justicia, Sergio Moro, anunciaron que hasta julio se han reportado 24.379 asesinatos en el país, lo que representa un 22,6% menos que el mismo periodo del 2018. Por eso, Bolsonaro recomendó condecorar a los policías.""";"publimetro";"2019-10-04";"8"
"Trump insta a China a investigar a familia Biden";"NA";"NA";"En medio del escándalo por el juicio político, el presidente estadounidense Donald Trump sostuvo que tanto Ucrania como China deben investigar a Joe Biden, quien es el demócrata favorito para disputarle una posible reelección en el 2020. En declaraciones a la prensa, Trump recomendó a su par chino, Xi Jinping, examinar también a su hijo Hunter Biden por sus negocios en el país asiático. De acuerdo a The New Yorker, Hunter Biden habría aceptado sobornos de un magnate chino en beneficio de su compañía. En Estados Unidos, es considerado ilegal pedir ayuda extranjera en una elección.";"publimetro";"2019-10-04";"8"
