"headline";"subheadline";"author";"content";"newspaper_name";"publication_date";"page_number"
"Adolfo Bazán acusado de violación";"NA";"Agosto de Precios Insuperables";"Adolfo Bazán (47) está acusado de violación por una chica que dice haber sido ultrajada en el sótano de un edificio en Macarena. También lo denunció por tocamientos indebidos. El abogado Manoso, quien estaba en el aeropuerto para ayudarle a fugarse, recibió impedimento de salida del país. Fiscal Domingo Pérez busca pruebas y allanaron locales de Fuerza Popular.";"trome";"2019-08-28";"1"
"NA";"NA";"NA";"Arroz extra Costeño x 5 kg S/ 16.80 Metro cencosud";"trome";"2019-08-28";"1"
"NA";"NA";"NA";"Página 12 Agosto de Precios Insuperables SOLO POR HOY";"trome";"2019-08-28";"1"
"NA";"NA";"NA";"El Papi' se vacila de 'bombón' MACARENA VÉLEZ";"trome";"2019-08-28";"1"
"NA";"NA";"NA";"Fiscal Domingo Pérez busca pruebas ALLANAN LOCALES DE FUERZA POPULAR";"trome";"2019-08-28";"1"
