"headline";"subheadline";"author";"content";"newspaper_name";"publication_date";"page_number"
"PROTESTAS HACEN TEMBLAR EL GOBIERNO DE NICOLÁS MADURO";"Hay decenas de estudiantes heridos y detenidos Miles salen a las calles por falta de pollo, leche, harina y papel higiénico SANGRE Y FUEGO EN VENEZUELA y niega que haya enviado fiscal a 'depande Sheyla'";"NA";"PROTESTAS HACEN TEMBLAR EL GOBIERNO DE NICOLÁS MADURO. Hay decenas de estudiantes heridos y detenidos. Miles salen a las calles por falta de pollo, leche, harina y papel higiénico. SANGRE Y FUEGO EN VENEZUELA. Maduro niega que haya enviado fiscal a 'depande Sheyla'.";"trome";"2015-02-13";"1"
"PAVÓN: MI HIJO NO ESTÁ EN ABANDONO";"NA";"NA";"PAVÓN afirma que su hijo no está en abandono, refiriéndose a las acusaciones recientes sobre el bienestar de su familia.";"trome";"2015-02-13";"1"
"VIENEN CON 'YAPA' POR 'DÍA DE LOS ENAMORADOS'";"NA";"NA";"En el Día de los Enamorados, varias tiendas ofrecen productos con 'yapa', es decir, regalos adicionales o descuentos especiales.";"trome";"2015-02-13";"1"
"LANZAN 'CALZONCILLOS GUTY'";"NA";"NA";"Se lanza una nueva línea de calzoncillos llamada 'Calzóncillos Guty', dirigida a un público joven y moderno.";"trome";"2015-02-13";"1"
"SOSPECHOSOS DE LIO DE TIERRAS EN SAN JUAN DE LURIGANCHO";"NA";"NA";"Hay sospechas sobre conflictos de tierras en San Juan de Lurigancho, lo que podría estar relacionado con la violencia reciente en la zona.";"trome";"2015-02-13";"1"
"SICARIOS EN MOTO MATAN A DOS VÍCTIMAS";"NA";"NA";"Dos personas fueron asesinadas por sicarios a bordo de una moto, aumentando las preocupaciones sobre la seguridad pública.";"trome";"2015-02-13";"1"
