"headline";"subheadline";"author";"content";"newspaper_name";"publication_date";"page_number"
"Los Olivos gritan 'malditos' a asesinos de estudiante";"NA";"NA";"En Los Olivos, la comunidad ha expresado su indignación y condena hacia los asesinos de un estudiante. La violencia en la zona ha generado una ola de protestas y reclamos por seguridad. Alquilaban mototaxi para cometer sus fechorías bajo la modalidad del ‘raqueteo’.";"trome";"2020-03-13";"4"
"Cercado de Lima: Chapan a 'Borrado' por robar banco";"NA";"NA";"En el Cercado de Lima, las autoridades capturaron a un sujeto conocido como 'Borrado', quien fue sorprendido robando un banco. La rápida acción policial ha sido alabada por la comunidad.";"trome";"2020-03-13";"4"
"Coloas: ‘July’ iba a asaltar grifo";"NA";"NA";"En Coloas, las autoridades detuvieron a una persona apodada 'July', quien planeaba asaltar un grifo. La intervención preventiva evitó el robo y mantuvo la seguridad en la zona.";"trome";"2020-03-13";"4"
"Carabayllo: Atrapan a manosos";"NA";"NA";"En Carabayllo, las autoridades lograron capturar a dos individuos que cometieron un robo. La noche del 13 de febrero, Ayurin Núñez y José Ramírez localizaron a una víctima y le robaron su celular.";"trome";"2020-03-13";"4"
"En ATE: Venezolanos caen por muerte de policía";"NA";"NA";"Tras la muerte de un policía en el distrito de Ate, se ha desatado una serie de detenciones entre miembros de la comunidad venezolana. Las autoridades están investigando su posible implicación en el incidente.";"trome";"2020-03-13";"4"
